CPU 0:
    0x00000000 0x00: eax=0x00000001 ebx=0x68747541 ecx=0x444D4163 edx=0x69746E65
    0x00000001 0x00: eax=0x00040F33 ebx=0x00020800 ecx=0x00002001 edx=0x178BFBFF
    0x80000000 0x00: eax=0x80000018 ebx=0x68747541 ecx=0x444D4163 edx=0x69746E65
    0x80000001 0x00: eax=0x00040F33 ebx=0x000009A7 ecx=0x0000001F edx=0xEBD3FBFF
    0x80000002 0x00: eax=0x20444D41 ebx=0x6C687441 ecx=0x74286E6F edx=0x3620296D
    0x80000003 0x00: eax=0x32582034 ebx=0x61754420 ecx=0x6F43206C edx=0x50206572
    0x80000004 0x00: eax=0x65636F72 ebx=0x726F7373 ecx=0x30343620 edx=0x00002B30
    0x80000005 0x00: eax=0xFF08FF08 ebx=0xFF20FF20 ecx=0x40020140 edx=0x40020140
    0x80000006 0x00: eax=0x00000000 ebx=0x42004200 ecx=0x04008140 edx=0x00000000
    0x80000007 0x00: eax=0x00000000 ebx=0x00000000 ecx=0x00000000 edx=0x0000003F
    0x80000008 0x00: eax=0x00003028 ebx=0x00000000 ecx=0x00000001 edx=0x00000000
    0x80000009 0x00: eax=0x00000000 ebx=0x00000000 ecx=0x00000000 edx=0x00000000
    0x8000000A 0x00: eax=0x00000001 ebx=0x00000040 ecx=0x00000000 edx=0x00000000
    0x8000000B 0x00: eax=0x00000000 ebx=0x00000000 ecx=0x00000000 edx=0x00000000
    0x8000000C 0x00: eax=0x00000000 ebx=0x00000000 ecx=0x00000000 edx=0x00000000
    0x8000000D 0x00: eax=0x00000000 ebx=0x00000000 ecx=0x00000000 edx=0x00000000
    0x8000000E 0x00: eax=0x00000000 ebx=0x00000000 ecx=0x00000000 edx=0x00000000
    0x8000000F 0x00: eax=0x00000000 ebx=0x00000000 ecx=0x00000000 edx=0x00000000
    0x80000010 0x00: eax=0x00000000 ebx=0x00000000 ecx=0x00000000 edx=0x00000000
    0x80000011 0x00: eax=0x00000000 ebx=0x00000000 ecx=0x00000000 edx=0x00000000
    0x80000012 0x00: eax=0x00000000 ebx=0x00000000 ecx=0x00000000 edx=0x00000000
    0x80000013 0x00: eax=0x00000000 ebx=0x00000000 ecx=0x00000000 edx=0x00000000
    0x80000014 0x00: eax=0x00000000 ebx=0x00000000 ecx=0x00000000 edx=0x00000000
    0x80000015 0x00: eax=0x00000000 ebx=0x00000000 ecx=0x00000000 edx=0x00000000
    0x80000016 0x00: eax=0x00000000 ebx=0x00000000 ecx=0x00000000 edx=0x00000000
    0x80000017 0x00: eax=0x00000000 ebx=0x00000000 ecx=0x00000000 edx=0x00000000
    0x80000018 0x00: eax=0x00000000 ebx=0x00000000 ecx=0x00000000 edx=0x00000000
CPU 1:
    0x00000000 0x00: eax=0x00000001 ebx=0x68747541 ecx=0x444D4163 edx=0x69746E65
    0x00000001 0x00: eax=0x00040F33 ebx=0x01020800 ecx=0x00002001 edx=0x178BFBFF
    0x80000000 0x00: eax=0x80000018 ebx=0x68747541 ecx=0x444D4163 edx=0x69746E65
    0x80000001 0x00: eax=0x00040F33 ebx=0x000009A7 ecx=0x0000001F edx=0xEBD3FBFF
    0x80000002 0x00: eax=0x20444D41 ebx=0x6C687441 ecx=0x74286E6F edx=0x3620296D
    0x80000003 0x00: eax=0x32582034 ebx=0x61754420 ecx=0x6F43206C edx=0x50206572
    0x80000004 0x00: eax=0x65636F72 ebx=0x726F7373 ecx=0x30343620 edx=0x00002B30
    0x80000005 0x00: eax=0xFF08FF08 ebx=0xFF20FF20 ecx=0x40020140 edx=0x40020140
    0x80000006 0x00: eax=0x00000000 ebx=0x42004200 ecx=0x04008140 edx=0x00000000
    0x80000007 0x00: eax=0x00000000 ebx=0x00000000 ecx=0x00000000 edx=0x0000003F
    0x80000008 0x00: eax=0x00003028 ebx=0x00000000 ecx=0x00000001 edx=0x00000000
    0x80000009 0x00: eax=0x00000000 ebx=0x00000000 ecx=0x00000000 edx=0x00000000
    0x8000000A 0x00: eax=0x00000001 ebx=0x00000040 ecx=0x00000000 edx=0x00000000
    0x8000000B 0x00: eax=0x00000000 ebx=0x00000000 ecx=0x00000000 edx=0x00000000
    0x8000000C 0x00: eax=0x00000000 ebx=0x00000000 ecx=0x00000000 edx=0x00000000
    0x8000000D 0x00: eax=0x00000000 ebx=0x00000000 ecx=0x00000000 edx=0x00000000
    0x8000000E 0x00: eax=0x00000000 ebx=0x00000000 ecx=0x00000000 edx=0x00000000
    0x8000000F 0x00: eax=0x00000000 ebx=0x00000000 ecx=0x00000000 edx=0x00000000
    0x80000010 0x00: eax=0x00000000 ebx=0x00000000 ecx=0x00000000 edx=0x00000000
    0x80000011 0x00: eax=0x00000000 ebx=0x00000000 ecx=0x00000000 edx=0x00000000
    0x80000012 0x00: eax=0x00000000 ebx=0x00000000 ecx=0x00000000 edx=0x00000000
    0x80000013 0x00: eax=0x00000000 ebx=0x00000000 ecx=0x00000000 edx=0x00000000
    0x80000014 0x00: eax=0x00000000 ebx=0x00000000 ecx=0x00000000 edx=0x00000000
    0x80000015 0x00: eax=0x00000000 ebx=0x00000000 ecx=0x00000000 edx=0x00000000
    0x80000016 0x00: eax=0x00000000 ebx=0x00000000 ecx=0x00000000 edx=0x00000000
    0x80000017 0x00: eax=0x00000000 ebx=0x00000000 ecx=0x00000000 edx=0x00000000
    0x80000018 0x00: eax=0x00000000 ebx=0x00000000 ecx=0x00000000 edx=0x00000000
