CPU 0:
    0x00000000 0x00: eax=0x00000001 ebx=0x68747541 ecx=0x444D4163 edx=0x69746E65
    0x00000001 0x00: eax=0x00000681 ebx=0x00000000 ecx=0x00000000 edx=0x0383F9FF
    0x80000000 0x00: eax=0x80000008 ebx=0x68747541 ecx=0x444D4163 edx=0x69746E65
    0x80000001 0x00: eax=0x00000781 ebx=0x00000000 ecx=0x00000000 edx=0xC1CBF9FF
    0x80000002 0x00: eax=0x69626F6D ebx=0x4120656C ecx=0x4120444D edx=0x6F6C6874
    0x80000003 0x00: eax=0x6D74286E ebx=0x50582029 ecx=0x31204D2D edx=0x2B303037
    0x80000004 0x00: eax=0x00000000 ebx=0x00000000 ecx=0x00000000 edx=0x00000000
    0x80000005 0x00: eax=0x0408FF08 ebx=0xFF20FF10 ecx=0x40020140 edx=0x40020140
    0x80000006 0x00: eax=0x00000000 ebx=0x41004100 ecx=0x01008140 edx=0x00000000
    0x80000007 0x00: eax=0x00000000 ebx=0x00000000 ecx=0x00000000 edx=0x00000007
    0x80000008 0x00: eax=0x00002022 ebx=0x00000000 ecx=0x00000000 edx=0x00000000
