CPU 0:
   0x00000000 0x00: eax=0x00000001 ebx=0x746e6543 ecx=0x736c7561 edx=0x48727561
   0x00000001 0x00: eax=0x000006a9 ebx=0x00010800 ecx=0x00000001 edx=0xa7c9bbff
   0x20000000 0x00: eax=0x00000000 ebx=0x00000000 ecx=0x00000000 edx=0x00000000
   0x80000000 0x00: eax=0x80000006 ebx=0x00000000 ecx=0x00000000 edx=0x00000000
   0x80000001 0x00: eax=0x00000000 ebx=0x00000000 ecx=0x00000000 edx=0x00100000
   0x80000002 0x00: eax=0x20202020 ebx=0x20202020 ecx=0x20202020 edx=0x20202020
   0x80000003 0x00: eax=0x56202020 ebx=0x45204149 ecx=0x65687473 edx=0x72702072
   0x80000004 0x00: eax=0x7365636f ebx=0x20726f73 ecx=0x30303531 edx=0x007a484d
   0x80000005 0x00: eax=0x00000000 ebx=0x08800880 ecx=0x40040140 edx=0x40040140
   0x80000006 0x00: eax=0x00000000 ebx=0x00000000 ecx=0x0080a140 edx=0x00000000
   0x80860000 0x00: eax=0x00000000 ebx=0x00000000 ecx=0x00000000 edx=0x00000000
   0xc0000000 0x00: eax=0xc0000002 ebx=0x00000000 ecx=0x00000000 edx=0x00000000
   0xc0000001 0x00: eax=0x00000000 ebx=0x00000000 ecx=0x00000000 edx=0x00003fcc
   0xc0000002 0x00: eax=0x00002201 ebx=0x0f000f18 ecx=0x0f180f18 edx=0x43c00000
