CPU 0:
    0x00000000 0x00: eax=0x00000024 ebx=0x756E6547 ecx=0x6C65746E edx=0x49656E69
    0x00000001 0x00: eax=0x000D0651 ebx=0x08800800 ecx=0xFFFAF38B edx=0xBFCBFBFF
    0x00000002 0x00: eax=0x00FEFF01 ebx=0x000000F0 ecx=0x00000000 edx=0x00000000
    0x00000003 0x00: eax=0x00000000 ebx=0x00000000 ecx=0x00000000 edx=0x00000000
    0x00000004 0x00: eax=0xFC004121 ebx=0x02C0003F ecx=0x0000003F edx=0x00000000
    0x00000004 0x01: eax=0xFC004122 ebx=0x03C0003F ecx=0x0000003F edx=0x00000000
    0x00000004 0x02: eax=0xFC01C143 ebx=0x02C0003F ecx=0x00000FFF edx=0x00000000
    0x00000004 0x03: eax=0xFC0FC163 ebx=0x02C0003F ecx=0x00001FFF edx=0x00000004
    0x00000005 0x00: eax=0x00000040 ebx=0x00000040 ecx=0x00000003 edx=0x00002020
    0x00000006 0x00: eax=0x009F8FF3 ebx=0x00000002 ecx=0x00000409 edx=0x00000003
    0x00000007 0x00: eax=0x00000002 ebx=0x239CA7A9 ecx=0x184007A4 edx=0xBC18C410
    0x00000007 0x01: eax=0x00C00997 ebx=0x00000000 ecx=0x00000000 edx=0x00000430
    0x00000007 0x02: eax=0x00000000 ebx=0x00000000 ecx=0x00000000 edx=0x00000011
    0x00000008 0x00: eax=0x00000000 ebx=0x00000000 ecx=0x00000000 edx=0x00000000
    0x00000009 0x00: eax=0x00000000 ebx=0x00000000 ecx=0x00000000 edx=0x00000000
    0x0000000A 0x00: eax=0x0D300806 ebx=0x00000280 ecx=0x00000007 edx=0x00008603
    0x0000000B 0x00: eax=0x00000001 ebx=0x00000001 ecx=0x00000100 edx=0x00000008
    0x0000000B 0x01: eax=0x00000007 ebx=0x00000005 ecx=0x00000201 edx=0x00000008
    0x0000000C 0x00: eax=0x00000000 ebx=0x00000000 ecx=0x00000000 edx=0x00000000
    0x0000000D 0x00: eax=0x00000007 ebx=0x00000340 ecx=0x00000340 edx=0x00000000
    0x0000000D 0x01: eax=0x0000000F ebx=0x00000350 ecx=0x00001800 edx=0x00000000
    0x0000000D 0x02: eax=0x00000100 ebx=0x00000240 ecx=0x00000000 edx=0x00000000
    0x0000000E 0x00: eax=0x00000000 ebx=0x00000000 ecx=0x00000000 edx=0x00000000
    0x0000000F 0x00: eax=0x00000000 ebx=0x00000000 ecx=0x00000000 edx=0x00000000
    0x00000010 0x00: eax=0x00000000 ebx=0x00000040 ecx=0x00000000 edx=0x00000000
    0x00000011 0x00: eax=0x00000000 ebx=0x00000000 ecx=0x00000000 edx=0x00000000
    0x00000012 0x00: eax=0x00000000 ebx=0x00000000 ecx=0x00000000 edx=0x00000000
    0x00000013 0x00: eax=0x00000000 ebx=0x00000000 ecx=0x00000000 edx=0x00000000
    0x00000014 0x00: eax=0x00000001 ebx=0x0000005F ecx=0x00000007 edx=0x00000000
    0x00000014 0x01: eax=0x02490002 ebx=0x003F003F ecx=0x00000000 edx=0x00000000
    0x00000015 0x00: eax=0x00000002 ebx=0x00000082 ecx=0x0249F000 edx=0x00000000
    0x00000016 0x00: eax=0x00000000 ebx=0x00000000 ecx=0x00000000 edx=0x00000000
    0x00000017 0x00: eax=0x00000000 ebx=0x00000000 ecx=0x00000000 edx=0x00000000
    0x00000018 0x00: eax=0x00000000 ebx=0x00000000 ecx=0x00000000 edx=0x00000000
    0x00000019 0x00: eax=0x00000000 ebx=0x00000000 ecx=0x00000000 edx=0x00000000
    0x0000001A 0x00: eax=0x40000004 ebx=0x00000000 ecx=0x00000000 edx=0x00000000
    0x0000001B 0x00: eax=0x00000000 ebx=0x00000000 ecx=0x00000000 edx=0x00000000
    0x0000001C 0x00: eax=0x4000000B ebx=0x00000007 ecx=0x00000007 edx=0x00000000
    0x0000001D 0x00: eax=0x00000000 ebx=0x00000000 ecx=0x00000000 edx=0x00000000
    0x0000001E 0x00: eax=0x00000000 ebx=0x00000000 ecx=0x00000000 edx=0x00000000
    0x0000001F 0x00: eax=0x00000001 ebx=0x00000001 ecx=0x00000100 edx=0x00000008
    0x0000001F 0x01: eax=0x00000003 ebx=0x00000001 ecx=0x00000201 edx=0x00000008
    0x0000001F 0x02: eax=0x00000007 ebx=0x00000005 ecx=0x00000302 edx=0x00000008
    0x00000020 0x00: eax=0x00000000 ebx=0x00000001 ecx=0x00000000 edx=0x00000000
    0x00000021 0x00: eax=0x00000000 ebx=0x00000000 ecx=0x00000000 edx=0x00000000
    0x00000022 0x00: eax=0x00000000 ebx=0x00000000 ecx=0x00000000 edx=0x00000000
    0x00000023 0x00: eax=0x0000003B ebx=0x00000000 ecx=0x00000000 edx=0x00000000
    0x00000024 0x00: eax=0x00000000 ebx=0x00000000 ecx=0x00000000 edx=0x00000000
    0x40000000 0x00: eax=0x4000000C ebx=0x7263694D ecx=0x666F736F edx=0x76482074
    0x40000001 0x00: eax=0x31237648 ebx=0x00000000 ecx=0x00000000 edx=0x00000000
    0x40000002 0x00: eax=0x000065F4 ebx=0x000A0000 ecx=0x00000009 edx=0x000024E4
    0x40000003 0x00: eax=0x00003FFF ebx=0x002BB9FF ecx=0x00000262 edx=0x77FEFBF6
    0x40000004 0x00: eax=0x00960E14 ebx=0x00000000 ecx=0x0000002E edx=0x00000000
    0x40000005 0x00: eax=0x00000800 ebx=0x00000800 ecx=0x000003A2 edx=0x00000000
    0x40000006 0x00: eax=0x098200AF ebx=0x0000002A ecx=0x00000000 edx=0x00000000
    0x40000007 0x00: eax=0x80000007 ebx=0x0000000B ecx=0x00000000 edx=0x00000000
    0x40000008 0x00: eax=0x00000000 ebx=0x00000000 ecx=0x00000000 edx=0x00000000
    0x40000009 0x00: eax=0x00000000 ebx=0x00000000 ecx=0x00000000 edx=0x00000000
    0x4000000A 0x00: eax=0x00000000 ebx=0x00000000 ecx=0x00000000 edx=0x00000000
    0x4000000B 0x00: eax=0x00000000 ebx=0x00000000 ecx=0x00000000 edx=0x00000000
    0x4000000C 0x00: eax=0x00000000 ebx=0x00000000 ecx=0x00000000 edx=0x00000000
    0x80000000 0x00: eax=0x80000008 ebx=0x00000000 ecx=0x00000000 edx=0x00000000
    0x80000001 0x00: eax=0x00000000 ebx=0x00000000 ecx=0x00000121 edx=0x2C100800
    0x80000002 0x00: eax=0x65746E49 ebx=0x2952286C ecx=0x726F4320 edx=0x4D542865
    0x80000003 0x00: eax=0x20332029 ebx=0x00343033 ecx=0x00000000 edx=0x00000000
    0x80000004 0x00: eax=0x00000000 ebx=0x00000000 ecx=0x00000000 edx=0x00000000
    0x80000005 0x00: eax=0x00000000 ebx=0x00000000 ecx=0x00000000 edx=0x00000000
    0x80000006 0x00: eax=0x00000000 ebx=0x00000000 ecx=0x0C007040 edx=0x00000000
    0x80000007 0x00: eax=0x00000000 ebx=0x00000000 ecx=0x00000000 edx=0x00000100
    0x80000008 0x00: eax=0x0000302E ebx=0x00000000 ecx=0x00000000 edx=0x00000000
CPU 1:
    0x00000000 0x00: eax=0x00000024 ebx=0x756E6547 ecx=0x6C65746E edx=0x49656E69
    0x00000001 0x00: eax=0x000D0651 ebx=0x40800800 ecx=0xFFFAF38B edx=0xBFCBFBFF
    0x00000002 0x00: eax=0x00FEFF01 ebx=0x000000F0 ecx=0x00000000 edx=0x00000000
    0x00000003 0x00: eax=0x00000000 ebx=0x00000000 ecx=0x00000000 edx=0x00000000
    0x00000004 0x00: eax=0xFC000121 ebx=0x01C0003F ecx=0x0000003F edx=0x00000001
    0x00000004 0x01: eax=0xFC000122 ebx=0x01C0003F ecx=0x0000007F edx=0x00000001
    0x00000004 0x02: eax=0xFC01C143 ebx=0x03C0003F ecx=0x00000FFF edx=0x00000001
    0x00000005 0x00: eax=0x00000040 ebx=0x00000040 ecx=0x00000003 edx=0x00002020
    0x00000006 0x00: eax=0x009F8FF3 ebx=0x00000002 ecx=0x00000409 edx=0x00010003
    0x00000007 0x00: eax=0x00000002 ebx=0x239CA7A9 ecx=0x184007A4 edx=0xBC18C410
    0x00000007 0x01: eax=0x00C00997 ebx=0x00000000 ecx=0x00000000 edx=0x00000430
    0x00000007 0x02: eax=0x00000000 ebx=0x00000000 ecx=0x00000000 edx=0x00000011
    0x00000008 0x00: eax=0x00000000 ebx=0x00000000 ecx=0x00000000 edx=0x00000000
    0x00000009 0x00: eax=0x00000000 ebx=0x00000000 ecx=0x00000000 edx=0x00000000
    0x0000000A 0x00: eax=0x0D300806 ebx=0x00000280 ecx=0x00000007 edx=0x00008603
    0x0000000B 0x00: eax=0x00000001 ebx=0x00000001 ecx=0x00000100 edx=0x00000040
    0x0000000B 0x01: eax=0x00000007 ebx=0x00000005 ecx=0x00000201 edx=0x00000040
    0x0000000C 0x00: eax=0x00000000 ebx=0x00000000 ecx=0x00000000 edx=0x00000000
    0x0000000D 0x00: eax=0x00000007 ebx=0x00000340 ecx=0x00000340 edx=0x00000000
    0x0000000D 0x01: eax=0x0000000F ebx=0x00000350 ecx=0x00001800 edx=0x00000000
    0x0000000D 0x02: eax=0x00000100 ebx=0x00000240 ecx=0x00000000 edx=0x00000000
    0x0000000E 0x00: eax=0x00000000 ebx=0x00000000 ecx=0x00000000 edx=0x00000000
    0x0000000F 0x00: eax=0x00000000 ebx=0x00000000 ecx=0x00000000 edx=0x00000000
    0x00000010 0x00: eax=0x00000000 ebx=0x00000040 ecx=0x00000000 edx=0x00000000
    0x00000011 0x00: eax=0x00000000 ebx=0x00000000 ecx=0x00000000 edx=0x00000000
    0x00000012 0x00: eax=0x00000000 ebx=0x00000000 ecx=0x00000000 edx=0x00000000
    0x00000013 0x00: eax=0x00000000 ebx=0x00000000 ecx=0x00000000 edx=0x00000000
    0x00000014 0x00: eax=0x00000001 ebx=0x0000005F ecx=0x80000007 edx=0x00000000
    0x00000014 0x01: eax=0x02490002 ebx=0x003F003F ecx=0x00000000 edx=0x00000000
    0x00000015 0x00: eax=0x00000002 ebx=0x00000082 ecx=0x0249F000 edx=0x00000000
    0x00000016 0x00: eax=0x00000000 ebx=0x00000000 ecx=0x00000000 edx=0x00000000
    0x00000017 0x00: eax=0x00000000 ebx=0x00000000 ecx=0x00000000 edx=0x00000000
    0x00000018 0x00: eax=0x00000000 ebx=0x00000000 ecx=0x00000000 edx=0x00000000
    0x00000019 0x00: eax=0x00000000 ebx=0x00000000 ecx=0x00000000 edx=0x00000000
    0x0000001A 0x00: eax=0x20000004 ebx=0x00000000 ecx=0x00000000 edx=0x00000000
    0x0000001B 0x00: eax=0x00000000 ebx=0x00000000 ecx=0x00000000 edx=0x00000000
    0x0000001C 0x00: eax=0x4000000B ebx=0x00000007 ecx=0x00000007 edx=0x00000000
    0x0000001D 0x00: eax=0x00000000 ebx=0x00000000 ecx=0x00000000 edx=0x00000000
    0x0000001E 0x00: eax=0x00000000 ebx=0x00000000 ecx=0x00000000 edx=0x00000000
    0x0000001F 0x00: eax=0x00000001 ebx=0x00000001 ecx=0x00000100 edx=0x00000040
    0x0000001F 0x01: eax=0x00000003 ebx=0x00000001 ecx=0x00000201 edx=0x00000040
    0x0000001F 0x02: eax=0x00000007 ebx=0x00000005 ecx=0x00000302 edx=0x00000040
    0x00000020 0x00: eax=0x00000000 ebx=0x00000001 ecx=0x00000000 edx=0x00000000
    0x00000021 0x00: eax=0x00000000 ebx=0x00000000 ecx=0x00000000 edx=0x00000000
    0x00000022 0x00: eax=0x00000000 ebx=0x00000000 ecx=0x00000000 edx=0x00000000
    0x00000023 0x00: eax=0x0000003B ebx=0x00000000 ecx=0x00000008 edx=0x00000000
    0x00000024 0x00: eax=0x00000000 ebx=0x00000000 ecx=0x00000000 edx=0x00000000
    0x40000000 0x00: eax=0x4000000C ebx=0x7263694D ecx=0x666F736F edx=0x76482074
    0x40000001 0x00: eax=0x31237648 ebx=0x00000000 ecx=0x00000000 edx=0x00000000
    0x40000002 0x00: eax=0x000065F4 ebx=0x000A0000 ecx=0x00000009 edx=0x000024E4
    0x40000003 0x00: eax=0x00003FFF ebx=0x002BB9FF ecx=0x00000262 edx=0x77FEFBF6
    0x40000004 0x00: eax=0x00960E14 ebx=0x00000000 ecx=0x0000002E edx=0x00000000
    0x40000005 0x00: eax=0x00000800 ebx=0x00000800 ecx=0x000003A2 edx=0x00000000
    0x40000006 0x00: eax=0x098200AF ebx=0x0000002A ecx=0x00000000 edx=0x00000000
    0x40000007 0x00: eax=0x80000007 ebx=0x0000000B ecx=0x00000000 edx=0x00000000
    0x40000008 0x00: eax=0x00000000 ebx=0x00000000 ecx=0x00000000 edx=0x00000000
    0x40000009 0x00: eax=0x00000000 ebx=0x00000000 ecx=0x00000000 edx=0x00000000
    0x4000000A 0x00: eax=0x00000000 ebx=0x00000000 ecx=0x00000000 edx=0x00000000
    0x4000000B 0x00: eax=0x00000000 ebx=0x00000000 ecx=0x00000000 edx=0x00000000
    0x4000000C 0x00: eax=0x00000000 ebx=0x00000000 ecx=0x00000000 edx=0x00000000
    0x80000000 0x00: eax=0x80000008 ebx=0x00000000 ecx=0x00000000 edx=0x00000000
    0x80000001 0x00: eax=0x00000000 ebx=0x00000000 ecx=0x00000121 edx=0x2C100800
    0x80000002 0x00: eax=0x65746E49 ebx=0x2952286C ecx=0x726F4320 edx=0x4D542865
    0x80000003 0x00: eax=0x20332029 ebx=0x00343033 ecx=0x00000000 edx=0x00000000
    0x80000004 0x00: eax=0x00000000 ebx=0x00000000 ecx=0x00000000 edx=0x00000000
    0x80000005 0x00: eax=0x00000000 ebx=0x00000000 ecx=0x00000000 edx=0x00000000
    0x80000006 0x00: eax=0x00000000 ebx=0x00000000 ecx=0x0C007040 edx=0x00000000
    0x80000007 0x00: eax=0x00000000 ebx=0x00000000 ecx=0x00000000 edx=0x00000100
    0x80000008 0x00: eax=0x0000302E ebx=0x00000000 ecx=0x00000000 edx=0x00000000
CPU 2:
    0x00000000 0x00: eax=0x00000024 ebx=0x756E6547 ecx=0x6C65746E edx=0x49656E69
    0x00000001 0x00: eax=0x000D0651 ebx=0x42800800 ecx=0xFFFAF38B edx=0xBFCBFBFF
    0x00000002 0x00: eax=0x00FEFF01 ebx=0x000000F0 ecx=0x00000000 edx=0x00000000
    0x00000003 0x00: eax=0x00000000 ebx=0x00000000 ecx=0x00000000 edx=0x00000000
    0x00000004 0x00: eax=0xFC000121 ebx=0x01C0003F ecx=0x0000003F edx=0x00000001
    0x00000004 0x01: eax=0xFC000122 ebx=0x01C0003F ecx=0x0000007F edx=0x00000001
    0x00000004 0x02: eax=0xFC01C143 ebx=0x03C0003F ecx=0x00000FFF edx=0x00000001
    0x00000005 0x00: eax=0x00000040 ebx=0x00000040 ecx=0x00000003 edx=0x00002020
    0x00000006 0x00: eax=0x009F8FF3 ebx=0x00000002 ecx=0x00000409 edx=0x00020003
    0x00000007 0x00: eax=0x00000002 ebx=0x239CA7A9 ecx=0x184007A4 edx=0xBC18C410
    0x00000007 0x01: eax=0x00C00997 ebx=0x00000000 ecx=0x00000000 edx=0x00000430
    0x00000007 0x02: eax=0x00000000 ebx=0x00000000 ecx=0x00000000 edx=0x00000011
    0x00000008 0x00: eax=0x00000000 ebx=0x00000000 ecx=0x00000000 edx=0x00000000
    0x00000009 0x00: eax=0x00000000 ebx=0x00000000 ecx=0x00000000 edx=0x00000000
    0x0000000A 0x00: eax=0x0D300806 ebx=0x00000280 ecx=0x00000007 edx=0x00008603
    0x0000000B 0x00: eax=0x00000001 ebx=0x00000001 ecx=0x00000100 edx=0x00000042
    0x0000000B 0x01: eax=0x00000007 ebx=0x00000005 ecx=0x00000201 edx=0x00000042
    0x0000000C 0x00: eax=0x00000000 ebx=0x00000000 ecx=0x00000000 edx=0x00000000
    0x0000000D 0x00: eax=0x00000007 ebx=0x00000340 ecx=0x00000340 edx=0x00000000
    0x0000000D 0x01: eax=0x0000000F ebx=0x00000350 ecx=0x00001800 edx=0x00000000
    0x0000000D 0x02: eax=0x00000100 ebx=0x00000240 ecx=0x00000000 edx=0x00000000
    0x0000000E 0x00: eax=0x00000000 ebx=0x00000000 ecx=0x00000000 edx=0x00000000
    0x0000000F 0x00: eax=0x00000000 ebx=0x00000000 ecx=0x00000000 edx=0x00000000
    0x00000010 0x00: eax=0x00000000 ebx=0x00000040 ecx=0x00000000 edx=0x00000000
    0x00000011 0x00: eax=0x00000000 ebx=0x00000000 ecx=0x00000000 edx=0x00000000
    0x00000012 0x00: eax=0x00000000 ebx=0x00000000 ecx=0x00000000 edx=0x00000000
    0x00000013 0x00: eax=0x00000000 ebx=0x00000000 ecx=0x00000000 edx=0x00000000
    0x00000014 0x00: eax=0x00000001 ebx=0x0000005F ecx=0x80000007 edx=0x00000000
    0x00000014 0x01: eax=0x02490002 ebx=0x003F003F ecx=0x00000000 edx=0x00000000
    0x00000015 0x00: eax=0x00000002 ebx=0x00000082 ecx=0x0249F000 edx=0x00000000
    0x00000016 0x00: eax=0x00000000 ebx=0x00000000 ecx=0x00000000 edx=0x00000000
    0x00000017 0x00: eax=0x00000000 ebx=0x00000000 ecx=0x00000000 edx=0x00000000
    0x00000018 0x00: eax=0x00000000 ebx=0x00000000 ecx=0x00000000 edx=0x00000000
    0x00000019 0x00: eax=0x00000000 ebx=0x00000000 ecx=0x00000000 edx=0x00000000
    0x0000001A 0x00: eax=0x20000004 ebx=0x00000000 ecx=0x00000000 edx=0x00000000
    0x0000001B 0x00: eax=0x00000000 ebx=0x00000000 ecx=0x00000000 edx=0x00000000
    0x0000001C 0x00: eax=0x4000000B ebx=0x00000007 ecx=0x00000007 edx=0x00000000
    0x0000001D 0x00: eax=0x00000000 ebx=0x00000000 ecx=0x00000000 edx=0x00000000
    0x0000001E 0x00: eax=0x00000000 ebx=0x00000000 ecx=0x00000000 edx=0x00000000
    0x0000001F 0x00: eax=0x00000001 ebx=0x00000001 ecx=0x00000100 edx=0x00000042
    0x0000001F 0x01: eax=0x00000003 ebx=0x00000001 ecx=0x00000201 edx=0x00000042
    0x0000001F 0x02: eax=0x00000007 ebx=0x00000005 ecx=0x00000302 edx=0x00000042
    0x00000020 0x00: eax=0x00000000 ebx=0x00000001 ecx=0x00000000 edx=0x00000000
    0x00000021 0x00: eax=0x00000000 ebx=0x00000000 ecx=0x00000000 edx=0x00000000
    0x00000022 0x00: eax=0x00000000 ebx=0x00000000 ecx=0x00000000 edx=0x00000000
    0x00000023 0x00: eax=0x0000003B ebx=0x00000000 ecx=0x00000008 edx=0x00000000
    0x00000024 0x00: eax=0x00000000 ebx=0x00000000 ecx=0x00000000 edx=0x00000000
    0x40000000 0x00: eax=0x4000000C ebx=0x7263694D ecx=0x666F736F edx=0x76482074
    0x40000001 0x00: eax=0x31237648 ebx=0x00000000 ecx=0x00000000 edx=0x00000000
    0x40000002 0x00: eax=0x000065F4 ebx=0x000A0000 ecx=0x00000009 edx=0x000024E4
    0x40000003 0x00: eax=0x00003FFF ebx=0x002BB9FF ecx=0x00000262 edx=0x77FEFBF6
    0x40000004 0x00: eax=0x00960E14 ebx=0x00000000 ecx=0x0000002E edx=0x00000000
    0x40000005 0x00: eax=0x00000800 ebx=0x00000800 ecx=0x000003A2 edx=0x00000000
    0x40000006 0x00: eax=0x098200AF ebx=0x0000002A ecx=0x00000000 edx=0x00000000
    0x40000007 0x00: eax=0x80000007 ebx=0x0000000B ecx=0x00000000 edx=0x00000000
    0x40000008 0x00: eax=0x00000000 ebx=0x00000000 ecx=0x00000000 edx=0x00000000
    0x40000009 0x00: eax=0x00000000 ebx=0x00000000 ecx=0x00000000 edx=0x00000000
    0x4000000A 0x00: eax=0x00000000 ebx=0x00000000 ecx=0x00000000 edx=0x00000000
    0x4000000B 0x00: eax=0x00000000 ebx=0x00000000 ecx=0x00000000 edx=0x00000000
    0x4000000C 0x00: eax=0x00000000 ebx=0x00000000 ecx=0x00000000 edx=0x00000000
    0x80000000 0x00: eax=0x80000008 ebx=0x00000000 ecx=0x00000000 edx=0x00000000
    0x80000001 0x00: eax=0x00000000 ebx=0x00000000 ecx=0x00000121 edx=0x2C100800
    0x80000002 0x00: eax=0x65746E49 ebx=0x2952286C ecx=0x726F4320 edx=0x4D542865
    0x80000003 0x00: eax=0x20332029 ebx=0x00343033 ecx=0x00000000 edx=0x00000000
    0x80000004 0x00: eax=0x00000000 ebx=0x00000000 ecx=0x00000000 edx=0x00000000
    0x80000005 0x00: eax=0x00000000 ebx=0x00000000 ecx=0x00000000 edx=0x00000000
    0x80000006 0x00: eax=0x00000000 ebx=0x00000000 ecx=0x0C007040 edx=0x00000000
    0x80000007 0x00: eax=0x00000000 ebx=0x00000000 ecx=0x00000000 edx=0x00000100
    0x80000008 0x00: eax=0x0000302E ebx=0x00000000 ecx=0x00000000 edx=0x00000000
CPU 3:
    0x00000000 0x00: eax=0x00000024 ebx=0x756E6547 ecx=0x6C65746E edx=0x49656E69
    0x00000001 0x00: eax=0x000D0651 ebx=0x44800800 ecx=0xFFFAF38B edx=0xBFCBFBFF
    0x00000002 0x00: eax=0x00FEFF01 ebx=0x000000F0 ecx=0x00000000 edx=0x00000000
    0x00000003 0x00: eax=0x00000000 ebx=0x00000000 ecx=0x00000000 edx=0x00000000
    0x00000004 0x00: eax=0xFC000121 ebx=0x01C0003F ecx=0x0000003F edx=0x00000001
    0x00000004 0x01: eax=0xFC000122 ebx=0x01C0003F ecx=0x0000007F edx=0x00000001
    0x00000004 0x02: eax=0xFC01C143 ebx=0x03C0003F ecx=0x00000FFF edx=0x00000001
    0x00000005 0x00: eax=0x00000040 ebx=0x00000040 ecx=0x00000003 edx=0x00002020
    0x00000006 0x00: eax=0x009F8FF3 ebx=0x00000002 ecx=0x00000409 edx=0x00030003
    0x00000007 0x00: eax=0x00000002 ebx=0x239CA7A9 ecx=0x184007A4 edx=0xBC18C410
    0x00000007 0x01: eax=0x00C00997 ebx=0x00000000 ecx=0x00000000 edx=0x00000430
    0x00000007 0x02: eax=0x00000000 ebx=0x00000000 ecx=0x00000000 edx=0x00000011
    0x00000008 0x00: eax=0x00000000 ebx=0x00000000 ecx=0x00000000 edx=0x00000000
    0x00000009 0x00: eax=0x00000000 ebx=0x00000000 ecx=0x00000000 edx=0x00000000
    0x0000000A 0x00: eax=0x0D300806 ebx=0x00000280 ecx=0x00000007 edx=0x00008603
    0x0000000B 0x00: eax=0x00000001 ebx=0x00000001 ecx=0x00000100 edx=0x00000044
    0x0000000B 0x01: eax=0x00000007 ebx=0x00000005 ecx=0x00000201 edx=0x00000044
    0x0000000C 0x00: eax=0x00000000 ebx=0x00000000 ecx=0x00000000 edx=0x00000000
    0x0000000D 0x00: eax=0x00000007 ebx=0x00000340 ecx=0x00000340 edx=0x00000000
    0x0000000D 0x01: eax=0x0000000F ebx=0x00000350 ecx=0x00001800 edx=0x00000000
    0x0000000D 0x02: eax=0x00000100 ebx=0x00000240 ecx=0x00000000 edx=0x00000000
    0x0000000E 0x00: eax=0x00000000 ebx=0x00000000 ecx=0x00000000 edx=0x00000000
    0x0000000F 0x00: eax=0x00000000 ebx=0x00000000 ecx=0x00000000 edx=0x00000000
    0x00000010 0x00: eax=0x00000000 ebx=0x00000040 ecx=0x00000000 edx=0x00000000
    0x00000011 0x00: eax=0x00000000 ebx=0x00000000 ecx=0x00000000 edx=0x00000000
    0x00000012 0x00: eax=0x00000000 ebx=0x00000000 ecx=0x00000000 edx=0x00000000
    0x00000013 0x00: eax=0x00000000 ebx=0x00000000 ecx=0x00000000 edx=0x00000000
    0x00000014 0x00: eax=0x00000001 ebx=0x0000005F ecx=0x80000007 edx=0x00000000
    0x00000014 0x01: eax=0x02490002 ebx=0x003F003F ecx=0x00000000 edx=0x00000000
    0x00000015 0x00: eax=0x00000002 ebx=0x00000082 ecx=0x0249F000 edx=0x00000000
    0x00000016 0x00: eax=0x00000000 ebx=0x00000000 ecx=0x00000000 edx=0x00000000
    0x00000017 0x00: eax=0x00000000 ebx=0x00000000 ecx=0x00000000 edx=0x00000000
    0x00000018 0x00: eax=0x00000000 ebx=0x00000000 ecx=0x00000000 edx=0x00000000
    0x00000019 0x00: eax=0x00000000 ebx=0x00000000 ecx=0x00000000 edx=0x00000000
    0x0000001A 0x00: eax=0x20000004 ebx=0x00000000 ecx=0x00000000 edx=0x00000000
    0x0000001B 0x00: eax=0x00000000 ebx=0x00000000 ecx=0x00000000 edx=0x00000000
    0x0000001C 0x00: eax=0x4000000B ebx=0x00000007 ecx=0x00000007 edx=0x00000000
    0x0000001D 0x00: eax=0x00000000 ebx=0x00000000 ecx=0x00000000 edx=0x00000000
    0x0000001E 0x00: eax=0x00000000 ebx=0x00000000 ecx=0x00000000 edx=0x00000000
    0x0000001F 0x00: eax=0x00000001 ebx=0x00000001 ecx=0x00000100 edx=0x00000044
    0x0000001F 0x01: eax=0x00000003 ebx=0x00000001 ecx=0x00000201 edx=0x00000044
    0x0000001F 0x02: eax=0x00000007 ebx=0x00000005 ecx=0x00000302 edx=0x00000044
    0x00000020 0x00: eax=0x00000000 ebx=0x00000001 ecx=0x00000000 edx=0x00000000
    0x00000021 0x00: eax=0x00000000 ebx=0x00000000 ecx=0x00000000 edx=0x00000000
    0x00000022 0x00: eax=0x00000000 ebx=0x00000000 ecx=0x00000000 edx=0x00000000
    0x00000023 0x00: eax=0x0000003B ebx=0x00000000 ecx=0x00000008 edx=0x00000000
    0x00000024 0x00: eax=0x00000000 ebx=0x00000000 ecx=0x00000000 edx=0x00000000
    0x40000000 0x00: eax=0x4000000C ebx=0x7263694D ecx=0x666F736F edx=0x76482074
    0x40000001 0x00: eax=0x31237648 ebx=0x00000000 ecx=0x00000000 edx=0x00000000
    0x40000002 0x00: eax=0x000065F4 ebx=0x000A0000 ecx=0x00000009 edx=0x000024E4
    0x40000003 0x00: eax=0x00003FFF ebx=0x002BB9FF ecx=0x00000262 edx=0x77FEFBF6
    0x40000004 0x00: eax=0x00960E14 ebx=0x00000000 ecx=0x0000002E edx=0x00000000
    0x40000005 0x00: eax=0x00000800 ebx=0x00000800 ecx=0x000003A2 edx=0x00000000
    0x40000006 0x00: eax=0x098200AF ebx=0x0000002A ecx=0x00000000 edx=0x00000000
    0x40000007 0x00: eax=0x80000007 ebx=0x0000000B ecx=0x00000000 edx=0x00000000
    0x40000008 0x00: eax=0x00000000 ebx=0x00000000 ecx=0x00000000 edx=0x00000000
    0x40000009 0x00: eax=0x00000000 ebx=0x00000000 ecx=0x00000000 edx=0x00000000
    0x4000000A 0x00: eax=0x00000000 ebx=0x00000000 ecx=0x00000000 edx=0x00000000
    0x4000000B 0x00: eax=0x00000000 ebx=0x00000000 ecx=0x00000000 edx=0x00000000
    0x4000000C 0x00: eax=0x00000000 ebx=0x00000000 ecx=0x00000000 edx=0x00000000
    0x80000000 0x00: eax=0x80000008 ebx=0x00000000 ecx=0x00000000 edx=0x00000000
    0x80000001 0x00: eax=0x00000000 ebx=0x00000000 ecx=0x00000121 edx=0x2C100800
    0x80000002 0x00: eax=0x65746E49 ebx=0x2952286C ecx=0x726F4320 edx=0x4D542865
    0x80000003 0x00: eax=0x20332029 ebx=0x00343033 ecx=0x00000000 edx=0x00000000
    0x80000004 0x00: eax=0x00000000 ebx=0x00000000 ecx=0x00000000 edx=0x00000000
    0x80000005 0x00: eax=0x00000000 ebx=0x00000000 ecx=0x00000000 edx=0x00000000
    0x80000006 0x00: eax=0x00000000 ebx=0x00000000 ecx=0x0C007040 edx=0x00000000
    0x80000007 0x00: eax=0x00000000 ebx=0x00000000 ecx=0x00000000 edx=0x00000100
    0x80000008 0x00: eax=0x0000302E ebx=0x00000000 ecx=0x00000000 edx=0x00000000
CPU 4:
    0x00000000 0x00: eax=0x00000024 ebx=0x756E6547 ecx=0x6C65746E edx=0x49656E69
    0x00000001 0x00: eax=0x000D0651 ebx=0x46800800 ecx=0xFFFAF38B edx=0xBFCBFBFF
    0x00000002 0x00: eax=0x00FEFF01 ebx=0x000000F0 ecx=0x00000000 edx=0x00000000
    0x00000003 0x00: eax=0x00000000 ebx=0x00000000 ecx=0x00000000 edx=0x00000000
    0x00000004 0x00: eax=0xFC000121 ebx=0x01C0003F ecx=0x0000003F edx=0x00000001
    0x00000004 0x01: eax=0xFC000122 ebx=0x01C0003F ecx=0x0000007F edx=0x00000001
    0x00000004 0x02: eax=0xFC01C143 ebx=0x03C0003F ecx=0x00000FFF edx=0x00000001
    0x00000005 0x00: eax=0x00000040 ebx=0x00000040 ecx=0x00000003 edx=0x00002020
    0x00000006 0x00: eax=0x009F8FF3 ebx=0x00000002 ecx=0x00000409 edx=0x00040003
    0x00000007 0x00: eax=0x00000002 ebx=0x239CA7A9 ecx=0x184007A4 edx=0xBC18C410
    0x00000007 0x01: eax=0x00C00997 ebx=0x00000000 ecx=0x00000000 edx=0x00000430
    0x00000007 0x02: eax=0x00000000 ebx=0x00000000 ecx=0x00000000 edx=0x00000011
    0x00000008 0x00: eax=0x00000000 ebx=0x00000000 ecx=0x00000000 edx=0x00000000
    0x00000009 0x00: eax=0x00000000 ebx=0x00000000 ecx=0x00000000 edx=0x00000000
    0x0000000A 0x00: eax=0x0D300806 ebx=0x00000280 ecx=0x00000007 edx=0x00008603
    0x0000000B 0x00: eax=0x00000001 ebx=0x00000001 ecx=0x00000100 edx=0x00000046
    0x0000000B 0x01: eax=0x00000007 ebx=0x00000005 ecx=0x00000201 edx=0x00000046
    0x0000000C 0x00: eax=0x00000000 ebx=0x00000000 ecx=0x00000000 edx=0x00000000
    0x0000000D 0x00: eax=0x00000007 ebx=0x00000340 ecx=0x00000340 edx=0x00000000
    0x0000000D 0x01: eax=0x0000000F ebx=0x00000350 ecx=0x00001800 edx=0x00000000
    0x0000000D 0x02: eax=0x00000100 ebx=0x00000240 ecx=0x00000000 edx=0x00000000
    0x0000000E 0x00: eax=0x00000000 ebx=0x00000000 ecx=0x00000000 edx=0x00000000
    0x0000000F 0x00: eax=0x00000000 ebx=0x00000000 ecx=0x00000000 edx=0x00000000
    0x00000010 0x00: eax=0x00000000 ebx=0x00000040 ecx=0x00000000 edx=0x00000000
    0x00000011 0x00: eax=0x00000000 ebx=0x00000000 ecx=0x00000000 edx=0x00000000
    0x00000012 0x00: eax=0x00000000 ebx=0x00000000 ecx=0x00000000 edx=0x00000000
    0x00000013 0x00: eax=0x00000000 ebx=0x00000000 ecx=0x00000000 edx=0x00000000
    0x00000014 0x00: eax=0x00000001 ebx=0x0000005F ecx=0x80000007 edx=0x00000000
    0x00000014 0x01: eax=0x02490002 ebx=0x003F003F ecx=0x00000000 edx=0x00000000
    0x00000015 0x00: eax=0x00000002 ebx=0x00000082 ecx=0x0249F000 edx=0x00000000
    0x00000016 0x00: eax=0x00000000 ebx=0x00000000 ecx=0x00000000 edx=0x00000000
    0x00000017 0x00: eax=0x00000000 ebx=0x00000000 ecx=0x00000000 edx=0x00000000
    0x00000018 0x00: eax=0x00000000 ebx=0x00000000 ecx=0x00000000 edx=0x00000000
    0x00000019 0x00: eax=0x00000000 ebx=0x00000000 ecx=0x00000000 edx=0x00000000
    0x0000001A 0x00: eax=0x20000004 ebx=0x00000000 ecx=0x00000000 edx=0x00000000
    0x0000001B 0x00: eax=0x00000000 ebx=0x00000000 ecx=0x00000000 edx=0x00000000
    0x0000001C 0x00: eax=0x4000000B ebx=0x00000007 ecx=0x00000007 edx=0x00000000
    0x0000001D 0x00: eax=0x00000000 ebx=0x00000000 ecx=0x00000000 edx=0x00000000
    0x0000001E 0x00: eax=0x00000000 ebx=0x00000000 ecx=0x00000000 edx=0x00000000
    0x0000001F 0x00: eax=0x00000001 ebx=0x00000001 ecx=0x00000100 edx=0x00000046
    0x0000001F 0x01: eax=0x00000003 ebx=0x00000001 ecx=0x00000201 edx=0x00000046
    0x0000001F 0x02: eax=0x00000007 ebx=0x00000005 ecx=0x00000302 edx=0x00000046
    0x00000020 0x00: eax=0x00000000 ebx=0x00000001 ecx=0x00000000 edx=0x00000000
    0x00000021 0x00: eax=0x00000000 ebx=0x00000000 ecx=0x00000000 edx=0x00000000
    0x00000022 0x00: eax=0x00000000 ebx=0x00000000 ecx=0x00000000 edx=0x00000000
    0x00000023 0x00: eax=0x0000003B ebx=0x00000000 ecx=0x00000008 edx=0x00000000
    0x00000024 0x00: eax=0x00000000 ebx=0x00000000 ecx=0x00000000 edx=0x00000000
    0x40000000 0x00: eax=0x4000000C ebx=0x7263694D ecx=0x666F736F edx=0x76482074
    0x40000001 0x00: eax=0x31237648 ebx=0x00000000 ecx=0x00000000 edx=0x00000000
    0x40000002 0x00: eax=0x000065F4 ebx=0x000A0000 ecx=0x00000009 edx=0x000024E4
    0x40000003 0x00: eax=0x00003FFF ebx=0x002BB9FF ecx=0x00000262 edx=0x77FEFBF6
    0x40000004 0x00: eax=0x00960E14 ebx=0x00000000 ecx=0x0000002E edx=0x00000000
    0x40000005 0x00: eax=0x00000800 ebx=0x00000800 ecx=0x000003A2 edx=0x00000000
    0x40000006 0x00: eax=0x098200AF ebx=0x0000002A ecx=0x00000000 edx=0x00000000
    0x40000007 0x00: eax=0x80000007 ebx=0x0000000B ecx=0x00000000 edx=0x00000000
    0x40000008 0x00: eax=0x00000000 ebx=0x00000000 ecx=0x00000000 edx=0x00000000
    0x40000009 0x00: eax=0x00000000 ebx=0x00000000 ecx=0x00000000 edx=0x00000000
    0x4000000A 0x00: eax=0x00000000 ebx=0x00000000 ecx=0x00000000 edx=0x00000000
    0x4000000B 0x00: eax=0x00000000 ebx=0x00000000 ecx=0x00000000 edx=0x00000000
    0x4000000C 0x00: eax=0x00000000 ebx=0x00000000 ecx=0x00000000 edx=0x00000000
    0x80000000 0x00: eax=0x80000008 ebx=0x00000000 ecx=0x00000000 edx=0x00000000
    0x80000001 0x00: eax=0x00000000 ebx=0x00000000 ecx=0x00000121 edx=0x2C100800
    0x80000002 0x00: eax=0x65746E49 ebx=0x2952286C ecx=0x726F4320 edx=0x4D542865
    0x80000003 0x00: eax=0x20332029 ebx=0x00343033 ecx=0x00000000 edx=0x00000000
    0x80000004 0x00: eax=0x00000000 ebx=0x00000000 ecx=0x00000000 edx=0x00000000
    0x80000005 0x00: eax=0x00000000 ebx=0x00000000 ecx=0x00000000 edx=0x00000000
    0x80000006 0x00: eax=0x00000000 ebx=0x00000000 ecx=0x0C007040 edx=0x00000000
    0x80000007 0x00: eax=0x00000000 ebx=0x00000000 ecx=0x00000000 edx=0x00000100
    0x80000008 0x00: eax=0x0000302E ebx=0x00000000 ecx=0x00000000 edx=0x00000000
