CPU 0:
    0x00000000 0x00: eax=0x0000000D ebx=0x756E6547 ecx=0x6C65746E edx=0x49656E69
    0x00000001 0x00: eax=0x000206D7 ebx=0x00200800 ecx=0x1FBEE3FF edx=0xBFEBFBFF
    0x00000002 0x00: eax=0x76035A01 ebx=0x00F0B0FF ecx=0x00000000 edx=0x00CA0000
    0x00000003 0x00: eax=0x00000000 ebx=0x00000000 ecx=0x00000000 edx=0x00000000
    0x00000004 0x00: eax=0x3C004121 ebx=0x01C0003F ecx=0x0000003F edx=0x00000000
    0x00000004 0x01: eax=0x3C004122 ebx=0x01C0003F ecx=0x0000003F edx=0x00000000
    0x00000004 0x02: eax=0x3C004143 ebx=0x01C0003F ecx=0x000001FF edx=0x00000000
    0x00000004 0x03: eax=0x3C07C163 ebx=0x04C0003F ecx=0x00001FFF edx=0x00000006
    0x00000005 0x00: eax=0x00000040 ebx=0x00000040 ecx=0x00000003 edx=0x00021120
    0x00000006 0x00: eax=0x00000075 ebx=0x00000002 ecx=0x00000001 edx=0x00000000
    0x00000007 0x00: eax=0x00000000 ebx=0x00000000 ecx=0x00000000 edx=0x9C000400
    0x00000008 0x00: eax=0x00000000 ebx=0x00000000 ecx=0x00000000 edx=0x00000000
    0x00000009 0x00: eax=0x00000000 ebx=0x00000000 ecx=0x00000000 edx=0x00000000
    0x0000000A 0x00: eax=0x07300803 ebx=0x00000000 ecx=0x00000000 edx=0x00000603
    0x0000000B 0x00: eax=0x00000001 ebx=0x00000001 ecx=0x00000100 edx=0x00000000
    0x0000000B 0x01: eax=0x00000005 ebx=0x00000004 ecx=0x00000201 edx=0x00000000
    0x0000000C 0x00: eax=0x00000000 ebx=0x00000000 ecx=0x00000000 edx=0x00000000
    0x0000000D 0x00: eax=0x00000007 ebx=0x00000340 ecx=0x00000340 edx=0x00000000
    0x0000000D 0x01: eax=0x00000001 ebx=0x00000000 ecx=0x00000000 edx=0x00000000
    0x0000000D 0x02: eax=0x00000100 ebx=0x00000240 ecx=0x00000000 edx=0x00000000
    0x80000000 0x00: eax=0x80000008 ebx=0x00000000 ecx=0x00000000 edx=0x00000000
    0x80000001 0x00: eax=0x00000000 ebx=0x00000000 ecx=0x00000001 edx=0x2C100800
    0x80000002 0x00: eax=0x20202020 ebx=0x49202020 ecx=0x6C65746E edx=0x20295228
    0x80000003 0x00: eax=0x6E6F6558 ebx=0x20295228 ecx=0x20555043 edx=0x322D3545
    0x80000004 0x00: eax=0x20373034 ebx=0x20402030 ecx=0x30322E32 edx=0x007A4847
    0x80000005 0x00: eax=0x00000000 ebx=0x00000000 ecx=0x00000000 edx=0x00000000
    0x80000006 0x00: eax=0x00000000 ebx=0x00000000 ecx=0x01006040 edx=0x00000000
    0x80000007 0x00: eax=0x00000000 ebx=0x00000000 ecx=0x00000000 edx=0x00000100
    0x80000008 0x00: eax=0x0000302E ebx=0x00000000 ecx=0x00000000 edx=0x00000000
CPU 1:
    0x00000000 0x00: eax=0x0000000D ebx=0x756E6547 ecx=0x6C65746E edx=0x49656E69
    0x00000001 0x00: eax=0x000206D7 ebx=0x00200800 ecx=0x1FBEE3FF edx=0xBFEBFBFF
    0x00000002 0x00: eax=0x76035A01 ebx=0x00F0B0FF ecx=0x00000000 edx=0x00CA0000
    0x00000003 0x00: eax=0x00000000 ebx=0x00000000 ecx=0x00000000 edx=0x00000000
    0x00000004 0x00: eax=0x3C004121 ebx=0x01C0003F ecx=0x0000003F edx=0x00000000
    0x00000004 0x01: eax=0x3C004122 ebx=0x01C0003F ecx=0x0000003F edx=0x00000000
    0x00000004 0x02: eax=0x3C004143 ebx=0x01C0003F ecx=0x000001FF edx=0x00000000
    0x00000004 0x03: eax=0x3C07C163 ebx=0x04C0003F ecx=0x00001FFF edx=0x00000006
    0x00000005 0x00: eax=0x00000040 ebx=0x00000040 ecx=0x00000003 edx=0x00021120
    0x00000006 0x00: eax=0x00000075 ebx=0x00000002 ecx=0x00000001 edx=0x00000000
    0x00000007 0x00: eax=0x00000000 ebx=0x00000000 ecx=0x00000000 edx=0x9C000400
    0x00000008 0x00: eax=0x00000000 ebx=0x00000000 ecx=0x00000000 edx=0x00000000
    0x00000009 0x00: eax=0x00000000 ebx=0x00000000 ecx=0x00000000 edx=0x00000000
    0x0000000A 0x00: eax=0x07300803 ebx=0x00000000 ecx=0x00000000 edx=0x00000603
    0x0000000B 0x00: eax=0x00000001 ebx=0x00000001 ecx=0x00000100 edx=0x00000000
    0x0000000B 0x01: eax=0x00000005 ebx=0x00000004 ecx=0x00000201 edx=0x00000000
    0x0000000C 0x00: eax=0x00000000 ebx=0x00000000 ecx=0x00000000 edx=0x00000000
    0x0000000D 0x00: eax=0x00000007 ebx=0x00000340 ecx=0x00000340 edx=0x00000000
    0x0000000D 0x01: eax=0x00000001 ebx=0x00000000 ecx=0x00000000 edx=0x00000000
    0x0000000D 0x02: eax=0x00000100 ebx=0x00000240 ecx=0x00000000 edx=0x00000000
    0x80000000 0x00: eax=0x80000008 ebx=0x00000000 ecx=0x00000000 edx=0x00000000
    0x80000001 0x00: eax=0x00000000 ebx=0x00000000 ecx=0x00000001 edx=0x2C100800
    0x80000002 0x00: eax=0x20202020 ebx=0x49202020 ecx=0x6C65746E edx=0x20295228
    0x80000003 0x00: eax=0x6E6F6558 ebx=0x20295228 ecx=0x20555043 edx=0x322D3545
    0x80000004 0x00: eax=0x20373034 ebx=0x20402030 ecx=0x30322E32 edx=0x007A4847
    0x80000005 0x00: eax=0x00000000 ebx=0x00000000 ecx=0x00000000 edx=0x00000000
    0x80000006 0x00: eax=0x00000000 ebx=0x00000000 ecx=0x01006040 edx=0x00000000
    0x80000007 0x00: eax=0x00000000 ebx=0x00000000 ecx=0x00000000 edx=0x00000100
    0x80000008 0x00: eax=0x0000302E ebx=0x00000000 ecx=0x00000000 edx=0x00000000
CPU 2:
    0x00000000 0x00: eax=0x0000000D ebx=0x756E6547 ecx=0x6C65746E edx=0x49656E69
    0x00000001 0x00: eax=0x000206D7 ebx=0x00200800 ecx=0x1FBEE3FF edx=0xBFEBFBFF
    0x00000002 0x00: eax=0x76035A01 ebx=0x00F0B0FF ecx=0x00000000 edx=0x00CA0000
    0x00000003 0x00: eax=0x00000000 ebx=0x00000000 ecx=0x00000000 edx=0x00000000
    0x00000004 0x00: eax=0x3C004121 ebx=0x01C0003F ecx=0x0000003F edx=0x00000000
    0x00000004 0x01: eax=0x3C004122 ebx=0x01C0003F ecx=0x0000003F edx=0x00000000
    0x00000004 0x02: eax=0x3C004143 ebx=0x01C0003F ecx=0x000001FF edx=0x00000000
    0x00000004 0x03: eax=0x3C07C163 ebx=0x04C0003F ecx=0x00001FFF edx=0x00000006
    0x00000005 0x00: eax=0x00000040 ebx=0x00000040 ecx=0x00000003 edx=0x00021120
    0x00000006 0x00: eax=0x00000075 ebx=0x00000002 ecx=0x00000001 edx=0x00000000
    0x00000007 0x00: eax=0x00000000 ebx=0x00000000 ecx=0x00000000 edx=0x9C000400
    0x00000008 0x00: eax=0x00000000 ebx=0x00000000 ecx=0x00000000 edx=0x00000000
    0x00000009 0x00: eax=0x00000000 ebx=0x00000000 ecx=0x00000000 edx=0x00000000
    0x0000000A 0x00: eax=0x07300803 ebx=0x00000000 ecx=0x00000000 edx=0x00000603
    0x0000000B 0x00: eax=0x00000001 ebx=0x00000001 ecx=0x00000100 edx=0x00000000
    0x0000000B 0x01: eax=0x00000005 ebx=0x00000004 ecx=0x00000201 edx=0x00000000
    0x0000000C 0x00: eax=0x00000000 ebx=0x00000000 ecx=0x00000000 edx=0x00000000
    0x0000000D 0x00: eax=0x00000007 ebx=0x00000340 ecx=0x00000340 edx=0x00000000
    0x0000000D 0x01: eax=0x00000001 ebx=0x00000000 ecx=0x00000000 edx=0x00000000
    0x0000000D 0x02: eax=0x00000100 ebx=0x00000240 ecx=0x00000000 edx=0x00000000
    0x80000000 0x00: eax=0x80000008 ebx=0x00000000 ecx=0x00000000 edx=0x00000000
    0x80000001 0x00: eax=0x00000000 ebx=0x00000000 ecx=0x00000001 edx=0x2C100800
    0x80000002 0x00: eax=0x20202020 ebx=0x49202020 ecx=0x6C65746E edx=0x20295228
    0x80000003 0x00: eax=0x6E6F6558 ebx=0x20295228 ecx=0x20555043 edx=0x322D3545
    0x80000004 0x00: eax=0x20373034 ebx=0x20402030 ecx=0x30322E32 edx=0x007A4847
    0x80000005 0x00: eax=0x00000000 ebx=0x00000000 ecx=0x00000000 edx=0x00000000
    0x80000006 0x00: eax=0x00000000 ebx=0x00000000 ecx=0x01006040 edx=0x00000000
    0x80000007 0x00: eax=0x00000000 ebx=0x00000000 ecx=0x00000000 edx=0x00000100
    0x80000008 0x00: eax=0x0000302E ebx=0x00000000 ecx=0x00000000 edx=0x00000000
CPU 3:
    0x00000000 0x00: eax=0x0000000D ebx=0x756E6547 ecx=0x6C65746E edx=0x49656E69
    0x00000001 0x00: eax=0x000206D7 ebx=0x00200800 ecx=0x1FBEE3FF edx=0xBFEBFBFF
    0x00000002 0x00: eax=0x76035A01 ebx=0x00F0B0FF ecx=0x00000000 edx=0x00CA0000
    0x00000003 0x00: eax=0x00000000 ebx=0x00000000 ecx=0x00000000 edx=0x00000000
    0x00000004 0x00: eax=0x3C004121 ebx=0x01C0003F ecx=0x0000003F edx=0x00000000
    0x00000004 0x01: eax=0x3C004122 ebx=0x01C0003F ecx=0x0000003F edx=0x00000000
    0x00000004 0x02: eax=0x3C004143 ebx=0x01C0003F ecx=0x000001FF edx=0x00000000
    0x00000004 0x03: eax=0x3C07C163 ebx=0x04C0003F ecx=0x00001FFF edx=0x00000006
    0x00000005 0x00: eax=0x00000040 ebx=0x00000040 ecx=0x00000003 edx=0x00021120
    0x00000006 0x00: eax=0x00000075 ebx=0x00000002 ecx=0x00000001 edx=0x00000000
    0x00000007 0x00: eax=0x00000000 ebx=0x00000000 ecx=0x00000000 edx=0x9C000400
    0x00000008 0x00: eax=0x00000000 ebx=0x00000000 ecx=0x00000000 edx=0x00000000
    0x00000009 0x00: eax=0x00000000 ebx=0x00000000 ecx=0x00000000 edx=0x00000000
    0x0000000A 0x00: eax=0x07300803 ebx=0x00000000 ecx=0x00000000 edx=0x00000603
    0x0000000B 0x00: eax=0x00000001 ebx=0x00000001 ecx=0x00000100 edx=0x00000000
    0x0000000B 0x01: eax=0x00000005 ebx=0x00000004 ecx=0x00000201 edx=0x00000000
    0x0000000C 0x00: eax=0x00000000 ebx=0x00000000 ecx=0x00000000 edx=0x00000000
    0x0000000D 0x00: eax=0x00000007 ebx=0x00000340 ecx=0x00000340 edx=0x00000000
    0x0000000D 0x01: eax=0x00000001 ebx=0x00000000 ecx=0x00000000 edx=0x00000000
    0x0000000D 0x02: eax=0x00000100 ebx=0x00000240 ecx=0x00000000 edx=0x00000000
    0x80000000 0x00: eax=0x80000008 ebx=0x00000000 ecx=0x00000000 edx=0x00000000
    0x80000001 0x00: eax=0x00000000 ebx=0x00000000 ecx=0x00000001 edx=0x2C100800
    0x80000002 0x00: eax=0x20202020 ebx=0x49202020 ecx=0x6C65746E edx=0x20295228
    0x80000003 0x00: eax=0x6E6F6558 ebx=0x20295228 ecx=0x20555043 edx=0x322D3545
    0x80000004 0x00: eax=0x20373034 ebx=0x20402030 ecx=0x30322E32 edx=0x007A4847
    0x80000005 0x00: eax=0x00000000 ebx=0x00000000 ecx=0x00000000 edx=0x00000000
    0x80000006 0x00: eax=0x00000000 ebx=0x00000000 ecx=0x01006040 edx=0x00000000
    0x80000007 0x00: eax=0x00000000 ebx=0x00000000 ecx=0x00000000 edx=0x00000100
    0x80000008 0x00: eax=0x0000302E ebx=0x00000000 ecx=0x00000000 edx=0x00000000
