CPU 0:
    0x00000000 0x00: eax=0x00000002 ebx=0x756E6547 ecx=0x6C65746E edx=0x49656E69
    0x00000001 0x00: eax=0x00000F27 ebx=0x00020809 ecx=0x00004400 edx=0xBFEBFBFF
    0x00000002 0x00: eax=0x665B5001 ebx=0x00000000 ecx=0x00000000 edx=0x007B7040
    0x80000000 0x00: eax=0x80000004 ebx=0x00000000 ecx=0x00000000 edx=0x00000000
    0x80000001 0x00: eax=0x00000000 ebx=0x00000000 ecx=0x00000000 edx=0x00000000
    0x80000002 0x00: eax=0x20202020 ebx=0x20202020 ecx=0x20202020 edx=0x6E492020
    0x80000003 0x00: eax=0x286C6574 ebx=0x50202952 ecx=0x69746E65 edx=0x52286D75
    0x80000004 0x00: eax=0x20342029 ebx=0x20555043 ecx=0x36302E33 edx=0x007A4847
CPU 1:
    0x00000000 0x00: eax=0x00000002 ebx=0x756E6547 ecx=0x6C65746E edx=0x49656E69
    0x00000001 0x00: eax=0x00000F27 ebx=0x00020809 ecx=0x00004400 edx=0xBFEBFBFF
    0x00000002 0x00: eax=0x665B5001 ebx=0x00000000 ecx=0x00000000 edx=0x007B7040
    0x80000000 0x00: eax=0x80000004 ebx=0x00000000 ecx=0x00000000 edx=0x00000000
    0x80000001 0x00: eax=0x00000000 ebx=0x00000000 ecx=0x00000000 edx=0x00000000
    0x80000002 0x00: eax=0x20202020 ebx=0x20202020 ecx=0x20202020 edx=0x6E492020
    0x80000003 0x00: eax=0x286C6574 ebx=0x50202952 ecx=0x69746E65 edx=0x52286D75
    0x80000004 0x00: eax=0x20342029 ebx=0x20555043 ecx=0x36302E33 edx=0x007A4847
