CPU 0:
    0x00000000 0x00: eax=0x0000000B ebx=0x756E6547 ecx=0x6C65746E edx=0x49656E69
    0x00000001 0x00: eax=0x00030678 ebx=0x00100800 ecx=0x41D8E3BF edx=0xBFEBFBFF
    0x00000002 0x00: eax=0x61B3A001 ebx=0x0000FFC2 ecx=0x00000000 edx=0x00000000
    0x00000003 0x00: eax=0x00000000 ebx=0x00000000 ecx=0x00000000 edx=0x00000000
    0x00000004 0x00: eax=0x1C000121 ebx=0x0140003F ecx=0x0000003F edx=0x00000001
    0x00000004 0x01: eax=0x1C000122 ebx=0x01C0003F ecx=0x0000003F edx=0x00000001
    0x00000004 0x02: eax=0x1C00C143 ebx=0x03C0003F ecx=0x000003FF edx=0x00000001
    0x00000005 0x00: eax=0x00000040 ebx=0x00000040 ecx=0x00000003 edx=0x33000020
    0x00000006 0x00: eax=0x00000007 ebx=0x00000002 ecx=0x00000009 edx=0x00000000
    0x00000007 0x00: eax=0x00000000 ebx=0x00002282 ecx=0x00000000 edx=0x0C000400
    0x00000008 0x00: eax=0x00000000 ebx=0x00000000 ecx=0x00000000 edx=0x00000000
    0x00000009 0x00: eax=0x00000000 ebx=0x00000000 ecx=0x00000000 edx=0x00000000
    0x0000000A 0x00: eax=0x07280203 ebx=0x00000000 ecx=0x00000000 edx=0x00004503
    0x0000000B 0x00: eax=0x00000001 ebx=0x00000001 ecx=0x00000100 edx=0x00000000
    0x0000000B 0x01: eax=0x00000004 ebx=0x00000004 ecx=0x00000201 edx=0x00000000
    0x80000000 0x00: eax=0x80000008 ebx=0x00000000 ecx=0x00000000 edx=0x00000000
    0x80000001 0x00: eax=0x00000000 ebx=0x00000000 ecx=0x00000101 edx=0x28100800
    0x80000002 0x00: eax=0x20202020 ebx=0x6E492020 ecx=0x286C6574 edx=0x50202952
    0x80000003 0x00: eax=0x69746E65 ebx=0x52286D75 ecx=0x50432029 edx=0x4E202055
    0x80000004 0x00: eax=0x30343533 ebx=0x20402020 ecx=0x36312E32 edx=0x007A4847
    0x80000005 0x00: eax=0x00000000 ebx=0x00000000 ecx=0x00000000 edx=0x00000000
    0x80000006 0x00: eax=0x00000000 ebx=0x00000000 ecx=0x04008040 edx=0x00000000
    0x80000007 0x00: eax=0x00000000 ebx=0x00000000 ecx=0x00000000 edx=0x00000100
    0x80000008 0x00: eax=0x00003024 ebx=0x00000000 ecx=0x00000000 edx=0x00000000
CPU 1:
    0x00000000 0x00: eax=0x0000000B ebx=0x756E6547 ecx=0x6C65746E edx=0x49656E69
    0x00000001 0x00: eax=0x00030678 ebx=0x02100800 ecx=0x41D8E3BF edx=0xBFEBFBFF
    0x00000002 0x00: eax=0x61B3A001 ebx=0x0000FFC2 ecx=0x00000000 edx=0x00000000
    0x00000003 0x00: eax=0x00000000 ebx=0x00000000 ecx=0x00000000 edx=0x00000000
    0x00000004 0x00: eax=0x1C000121 ebx=0x0140003F ecx=0x0000003F edx=0x00000001
    0x00000004 0x01: eax=0x1C000122 ebx=0x01C0003F ecx=0x0000003F edx=0x00000001
    0x00000004 0x02: eax=0x1C00C143 ebx=0x03C0003F ecx=0x000003FF edx=0x00000001
    0x00000005 0x00: eax=0x00000040 ebx=0x00000040 ecx=0x00000003 edx=0x33000020
    0x00000006 0x00: eax=0x00000007 ebx=0x00000002 ecx=0x00000009 edx=0x00000000
    0x00000007 0x00: eax=0x00000000 ebx=0x00002282 ecx=0x00000000 edx=0x0C000400
    0x00000008 0x00: eax=0x00000000 ebx=0x00000000 ecx=0x00000000 edx=0x00000000
    0x00000009 0x00: eax=0x00000000 ebx=0x00000000 ecx=0x00000000 edx=0x00000000
    0x0000000A 0x00: eax=0x07280203 ebx=0x00000000 ecx=0x00000000 edx=0x00004503
    0x0000000B 0x00: eax=0x00000001 ebx=0x00000001 ecx=0x00000100 edx=0x00000002
    0x0000000B 0x01: eax=0x00000004 ebx=0x00000004 ecx=0x00000201 edx=0x00000002
    0x80000000 0x00: eax=0x80000008 ebx=0x00000000 ecx=0x00000000 edx=0x00000000
    0x80000001 0x00: eax=0x00000000 ebx=0x00000000 ecx=0x00000101 edx=0x28100800
    0x80000002 0x00: eax=0x20202020 ebx=0x6E492020 ecx=0x286C6574 edx=0x50202952
    0x80000003 0x00: eax=0x69746E65 ebx=0x52286D75 ecx=0x50432029 edx=0x4E202055
    0x80000004 0x00: eax=0x30343533 ebx=0x20402020 ecx=0x36312E32 edx=0x007A4847
    0x80000005 0x00: eax=0x00000000 ebx=0x00000000 ecx=0x00000000 edx=0x00000000
    0x80000006 0x00: eax=0x00000000 ebx=0x00000000 ecx=0x04008040 edx=0x00000000
    0x80000007 0x00: eax=0x00000000 ebx=0x00000000 ecx=0x00000000 edx=0x00000100
    0x80000008 0x00: eax=0x00003024 ebx=0x00000000 ecx=0x00000000 edx=0x00000000
CPU 2:
    0x00000000 0x00: eax=0x0000000B ebx=0x756E6547 ecx=0x6C65746E edx=0x49656E69
    0x00000001 0x00: eax=0x00030678 ebx=0x04100800 ecx=0x41D8E3BF edx=0xBFEBFBFF
    0x00000002 0x00: eax=0x61B3A001 ebx=0x0000FFC2 ecx=0x00000000 edx=0x00000000
    0x00000003 0x00: eax=0x00000000 ebx=0x00000000 ecx=0x00000000 edx=0x00000000
    0x00000004 0x00: eax=0x1C000121 ebx=0x0140003F ecx=0x0000003F edx=0x00000001
    0x00000004 0x01: eax=0x1C000122 ebx=0x01C0003F ecx=0x0000003F edx=0x00000001
    0x00000004 0x02: eax=0x1C00C143 ebx=0x03C0003F ecx=0x000003FF edx=0x00000001
    0x00000005 0x00: eax=0x00000040 ebx=0x00000040 ecx=0x00000003 edx=0x33000020
    0x00000006 0x00: eax=0x00000007 ebx=0x00000002 ecx=0x00000009 edx=0x00000000
    0x00000007 0x00: eax=0x00000000 ebx=0x00002282 ecx=0x00000000 edx=0x0C000400
    0x00000008 0x00: eax=0x00000000 ebx=0x00000000 ecx=0x00000000 edx=0x00000000
    0x00000009 0x00: eax=0x00000000 ebx=0x00000000 ecx=0x00000000 edx=0x00000000
    0x0000000A 0x00: eax=0x07280203 ebx=0x00000000 ecx=0x00000000 edx=0x00004503
    0x0000000B 0x00: eax=0x00000001 ebx=0x00000001 ecx=0x00000100 edx=0x00000004
    0x0000000B 0x01: eax=0x00000004 ebx=0x00000004 ecx=0x00000201 edx=0x00000004
    0x80000000 0x00: eax=0x80000008 ebx=0x00000000 ecx=0x00000000 edx=0x00000000
    0x80000001 0x00: eax=0x00000000 ebx=0x00000000 ecx=0x00000101 edx=0x28100800
    0x80000002 0x00: eax=0x20202020 ebx=0x6E492020 ecx=0x286C6574 edx=0x50202952
    0x80000003 0x00: eax=0x69746E65 ebx=0x52286D75 ecx=0x50432029 edx=0x4E202055
    0x80000004 0x00: eax=0x30343533 ebx=0x20402020 ecx=0x36312E32 edx=0x007A4847
    0x80000005 0x00: eax=0x00000000 ebx=0x00000000 ecx=0x00000000 edx=0x00000000
    0x80000006 0x00: eax=0x00000000 ebx=0x00000000 ecx=0x04008040 edx=0x00000000
    0x80000007 0x00: eax=0x00000000 ebx=0x00000000 ecx=0x00000000 edx=0x00000100
    0x80000008 0x00: eax=0x00003024 ebx=0x00000000 ecx=0x00000000 edx=0x00000000
CPU 3:
    0x00000000 0x00: eax=0x0000000B ebx=0x756E6547 ecx=0x6C65746E edx=0x49656E69
    0x00000001 0x00: eax=0x00030678 ebx=0x06100800 ecx=0x41D8E3BF edx=0xBFEBFBFF
    0x00000002 0x00: eax=0x61B3A001 ebx=0x0000FFC2 ecx=0x00000000 edx=0x00000000
    0x00000003 0x00: eax=0x00000000 ebx=0x00000000 ecx=0x00000000 edx=0x00000000
    0x00000004 0x00: eax=0x1C000121 ebx=0x0140003F ecx=0x0000003F edx=0x00000001
    0x00000004 0x01: eax=0x1C000122 ebx=0x01C0003F ecx=0x0000003F edx=0x00000001
    0x00000004 0x02: eax=0x1C00C143 ebx=0x03C0003F ecx=0x000003FF edx=0x00000001
    0x00000005 0x00: eax=0x00000040 ebx=0x00000040 ecx=0x00000003 edx=0x33000020
    0x00000006 0x00: eax=0x00000007 ebx=0x00000002 ecx=0x00000009 edx=0x00000000
    0x00000007 0x00: eax=0x00000000 ebx=0x00002282 ecx=0x00000000 edx=0x0C000400
    0x00000008 0x00: eax=0x00000000 ebx=0x00000000 ecx=0x00000000 edx=0x00000000
    0x00000009 0x00: eax=0x00000000 ebx=0x00000000 ecx=0x00000000 edx=0x00000000
    0x0000000A 0x00: eax=0x07280203 ebx=0x00000000 ecx=0x00000000 edx=0x00004503
    0x0000000B 0x00: eax=0x00000001 ebx=0x00000001 ecx=0x00000100 edx=0x00000006
    0x0000000B 0x01: eax=0x00000004 ebx=0x00000004 ecx=0x00000201 edx=0x00000006
    0x80000000 0x00: eax=0x80000008 ebx=0x00000000 ecx=0x00000000 edx=0x00000000
    0x80000001 0x00: eax=0x00000000 ebx=0x00000000 ecx=0x00000101 edx=0x28100800
    0x80000002 0x00: eax=0x20202020 ebx=0x6E492020 ecx=0x286C6574 edx=0x50202952
    0x80000003 0x00: eax=0x69746E65 ebx=0x52286D75 ecx=0x50432029 edx=0x4E202055
    0x80000004 0x00: eax=0x30343533 ebx=0x20402020 ecx=0x36312E32 edx=0x007A4847
    0x80000005 0x00: eax=0x00000000 ebx=0x00000000 ecx=0x00000000 edx=0x00000000
    0x80000006 0x00: eax=0x00000000 ebx=0x00000000 ecx=0x04008040 edx=0x00000000
    0x80000007 0x00: eax=0x00000000 ebx=0x00000000 ecx=0x00000000 edx=0x00000100
    0x80000008 0x00: eax=0x00003024 ebx=0x00000000 ecx=0x00000000 edx=0x00000000
