CPU 0:
   0x00000000 0x00: eax=0x00000002 ebx=0x756e6547 ecx=0x6c65746e edx=0x49656e69
   0x00000001 0x00: eax=0x00000619 ebx=0x00000000 ecx=0x00000000 edx=0x0000fbff
   0x00000002 0x00: eax=0x03020101 ebx=0x00000000 ecx=0x00000000 edx=0x06040a44
   0x20000000 0x00: eax=0x03020101 ebx=0x00000000 ecx=0x00000000 edx=0x06040a44
   0x80000000 0x00: eax=0x03020101 ebx=0x00000000 ecx=0x00000000 edx=0x06040a44
   0x80860000 0x00: eax=0x03020101 ebx=0x00000000 ecx=0x00000000 edx=0x06040a44
   0xc0000000 0x00: eax=0x03020101 ebx=0x00000000 ecx=0x00000000 edx=0x06040a44
CPU 1:
   0x00000000 0x00: eax=0x00000002 ebx=0x756e6547 ecx=0x6c65746e edx=0x49656e69
   0x00000001 0x00: eax=0x00000619 ebx=0x00000000 ecx=0x00000000 edx=0x0000fbff
   0x00000002 0x00: eax=0x03020101 ebx=0x00000000 ecx=0x00000000 edx=0x06040a44
   0x20000000 0x00: eax=0x03020101 ebx=0x00000000 ecx=0x00000000 edx=0x06040a44
   0x80000000 0x00: eax=0x03020101 ebx=0x00000000 ecx=0x00000000 edx=0x06040a44
   0x80860000 0x00: eax=0x03020101 ebx=0x00000000 ecx=0x00000000 edx=0x06040a44
   0xc0000000 0x00: eax=0x03020101 ebx=0x00000000 ecx=0x00000000 edx=0x06040a44
