CPU 0:
    0x00000000 0x00: eax=0x0000000A ebx=0x746E6543 ecx=0x736C7561 edx=0x48727561
    0x00000001 0x00: eax=0x000006FD ebx=0x00040800 ecx=0x008863A9 edx=0xBFC9FBFF
    0x00000002 0x00: eax=0x02B3B001 ebx=0x00000000 ecx=0x00000000 edx=0x2C04307D
    0x00000003 0x00: eax=0x00000000 ebx=0x00000000 ecx=0x00000000 edx=0x00000000
    0x00000004 0x00: eax=0x0C000021 ebx=0x03C0003F ecx=0x0000003F edx=0x00000000
    0x00000004 0x01: eax=0x0C000022 ebx=0x03C0003F ecx=0x0000003F edx=0x00000000
    0x00000004 0x02: eax=0x0C000043 ebx=0x07C0003F ecx=0x000001FF edx=0x00000000
    0x00000005 0x00: eax=0x00000040 ebx=0x00000040 ecx=0x00000003 edx=0x00022220
    0x00000006 0x00: eax=0x00000002 ebx=0x00000000 ecx=0x00000000 edx=0x00000000
    0x00000007 0x00: eax=0x00000000 ebx=0x00000000 ecx=0x00000000 edx=0x00000000
    0x00000008 0x00: eax=0x00000000 ebx=0x00000000 ecx=0x00000000 edx=0x00000000
    0x00000009 0x00: eax=0x00000000 ebx=0x00000000 ecx=0x00000000 edx=0x00000000
    0x0000000A 0x00: eax=0x06280202 ebx=0x00000000 ecx=0x00000000 edx=0x00000503
    0x80000000 0x00: eax=0x80000008 ebx=0x00000000 ecx=0x00000000 edx=0x00000000
    0x80000001 0x00: eax=0x00000000 ebx=0x00000000 ecx=0x00000001 edx=0x20100800
    0x80000002 0x00: eax=0x20202020 ebx=0x20202020 ecx=0x20202020 edx=0x20202020
    0x80000003 0x00: eax=0x56202020 ebx=0x45204149 ecx=0x206E6564 edx=0x55203258
    0x80000004 0x00: eax=0x30303234 ebx=0x31204020 ecx=0x202B302E edx=0x007A4847
    0x80000005 0x00: eax=0x00000000 ebx=0x08800880 ecx=0x40100140 edx=0x40100140
    0x80000006 0x00: eax=0x00000000 ebx=0x00000000 ecx=0x04008140 edx=0x00000000
    0x80000007 0x00: eax=0x00000000 ebx=0x00000000 ecx=0x00000000 edx=0x00000000
    0x80000008 0x00: eax=0x00003024 ebx=0x00000000 ecx=0x00000000 edx=0x00000000
    0xC0000000 0x00: eax=0xC0000004 ebx=0x00000000 ecx=0x00000000 edx=0x00000000
    0xC0000001 0x00: eax=0x000006FD ebx=0x00000000 ecx=0x00000000 edx=0x1EC33DCC
    0xC0000002 0x00: eax=0x00000000 ebx=0x00000000 ecx=0x00000000 edx=0x00000000
    0xC0000003 0x00: eax=0x00000000 ebx=0x00000000 ecx=0x00000000 edx=0x00000000
    0xC0000004 0x00: eax=0x0000001F ebx=0x08000A4D ecx=0x08470A4B edx=0x00000000
CPU 1:
    0x00000000 0x00: eax=0x0000000A ebx=0x746E6543 ecx=0x736C7561 edx=0x48727561
    0x00000001 0x00: eax=0x000006FD ebx=0x00040800 ecx=0x008863A9 edx=0xBFC9FBFF
    0x00000002 0x00: eax=0x02B3B001 ebx=0x00000000 ecx=0x00000000 edx=0x2C04307D
    0x00000003 0x00: eax=0x00000000 ebx=0x00000000 ecx=0x00000000 edx=0x00000000
    0x00000004 0x00: eax=0x0C000021 ebx=0x03C0003F ecx=0x0000003F edx=0x00000000
    0x00000004 0x01: eax=0x0C000022 ebx=0x03C0003F ecx=0x0000003F edx=0x00000000
    0x00000004 0x02: eax=0x0C000043 ebx=0x07C0003F ecx=0x000001FF edx=0x00000000
    0x00000005 0x00: eax=0x00000040 ebx=0x00000040 ecx=0x00000003 edx=0x00022220
    0x00000006 0x00: eax=0x00000002 ebx=0x00000000 ecx=0x00000000 edx=0x00000000
    0x00000007 0x00: eax=0x00000000 ebx=0x00000000 ecx=0x00000000 edx=0x00000000
    0x00000008 0x00: eax=0x00000000 ebx=0x00000000 ecx=0x00000000 edx=0x00000000
    0x00000009 0x00: eax=0x00000000 ebx=0x00000000 ecx=0x00000000 edx=0x00000000
    0x0000000A 0x00: eax=0x06280202 ebx=0x00000000 ecx=0x00000000 edx=0x00000503
    0x80000000 0x00: eax=0x80000008 ebx=0x00000000 ecx=0x00000000 edx=0x00000000
    0x80000001 0x00: eax=0x00000000 ebx=0x00000000 ecx=0x00000001 edx=0x20100800
    0x80000002 0x00: eax=0x20202020 ebx=0x20202020 ecx=0x20202020 edx=0x20202020
    0x80000003 0x00: eax=0x56202020 ebx=0x45204149 ecx=0x206E6564 edx=0x55203258
    0x80000004 0x00: eax=0x30303234 ebx=0x31204020 ecx=0x202B302E edx=0x007A4847
    0x80000005 0x00: eax=0x00000000 ebx=0x08800880 ecx=0x40100140 edx=0x40100140
    0x80000006 0x00: eax=0x00000000 ebx=0x00000000 ecx=0x04008140 edx=0x00000000
    0x80000007 0x00: eax=0x00000000 ebx=0x00000000 ecx=0x00000000 edx=0x00000000
    0x80000008 0x00: eax=0x00003024 ebx=0x00000000 ecx=0x00000000 edx=0x00000000
    0xC0000000 0x00: eax=0xC0000004 ebx=0x00000000 ecx=0x00000000 edx=0x00000000
    0xC0000001 0x00: eax=0x000006FD ebx=0x00000000 ecx=0x00000000 edx=0x1EC33DCC
    0xC0000002 0x00: eax=0x00000000 ebx=0x00000000 ecx=0x00000000 edx=0x00000000
    0xC0000003 0x00: eax=0x00000000 ebx=0x00000000 ecx=0x00000000 edx=0x00000000
    0xC0000004 0x00: eax=0x0000001F ebx=0x08000A4D ecx=0x08470A4B edx=0x00000000
