CPU 0:
   0x00000000 0x00: eax=0x00000003 ebx=0x74726f56 ecx=0x436f5320 edx=0x36387865
   0x00000001 0x00: eax=0x00000611 ebx=0x00000000 ecx=0x00000000 edx=0x0380ab39
   0x00000002 0x00: eax=0x00000001 ebx=0x00000042 ecx=0x02500008 edx=0x0403000c
   0x00000003 0x00: eax=0x00000000 ebx=0x00000000 ecx=0x00000000 edx=0x00000000
   0x20000000 0x00: eax=0x00000000 ebx=0x00000000 ecx=0x00000000 edx=0x00000000
   0x80000000 0x00: eax=0x80000004 ebx=0x00000000 ecx=0x00000000 edx=0x00000000
   0x80000001 0x00: eax=0x00000000 ebx=0x00000000 ecx=0x00000000 edx=0x00000000
   0x80000002 0x00: eax=0x74726f56 ebx=0x36387865 ecx=0x20335844 edx=0x20202020
   0x80000003 0x00: eax=0x20202020 ebx=0x20202020 ecx=0x20202020 edx=0x20202020
   0x80000004 0x00: eax=0x20202020 ebx=0x20202020 ecx=0x20202020 edx=0x20202020
   0x80860000 0x00: eax=0x00000000 ebx=0x00000000 ecx=0x00000000 edx=0x00000000
   0xc0000000 0x00: eax=0x00000000 ebx=0x00000000 ecx=0x00000000 edx=0x00000000
CPU 1:
   0x00000000 0x00: eax=0x00000003 ebx=0x74726f56 ecx=0x436f5320 edx=0x36387865
   0x00000001 0x00: eax=0x00000611 ebx=0x01000000 ecx=0x00000000 edx=0x0380ab39
   0x00000002 0x00: eax=0x00000001 ebx=0x00000042 ecx=0x02500008 edx=0x0403000c
   0x00000003 0x00: eax=0x00000000 ebx=0x00000000 ecx=0x00000000 edx=0x00000000
   0x20000000 0x00: eax=0x00000000 ebx=0x00000000 ecx=0x00000000 edx=0x00000000
   0x80000000 0x00: eax=0x80000004 ebx=0x00000000 ecx=0x00000000 edx=0x00000000
   0x80000001 0x00: eax=0x00000000 ebx=0x00000000 ecx=0x00000000 edx=0x00000000
   0x80000002 0x00: eax=0x74726f56 ebx=0x36387865 ecx=0x20335844 edx=0x20202020
   0x80000003 0x00: eax=0x20202020 ebx=0x20202020 ecx=0x20202020 edx=0x20202020
   0x80000004 0x00: eax=0x20202020 ebx=0x20202020 ecx=0x20202020 edx=0x20202020
   0x80860000 0x00: eax=0x00000000 ebx=0x00000000 ecx=0x00000000 edx=0x00000000
   0xc0000000 0x00: eax=0x00000000 ebx=0x00000000 ecx=0x00000000 edx=0x00000000
