CPU 0:
   0x00000000 0x00: eax=0x0000000d ebx=0x746e6543 ecx=0x736c7561 edx=0x48727561
   0x00000001 0x00: eax=0x000107b0 ebx=0x00040800 ecx=0x7fda63eb edx=0xbfcbfbff
   0x00000002 0x00: eax=0x635af001 ebx=0x00000000 ecx=0x00000000 edx=0x000000ff
   0x00000003 0x00: eax=0x00000000 ebx=0x00000000 ecx=0x00000000 edx=0x00000000
   0x00000004 0x00: eax=0x0c000121 ebx=0x01c0003f ecx=0x0000003f edx=0x00000000
   0x00000004 0x01: eax=0x0c000122 ebx=0x01c0003f ecx=0x0000003f edx=0x00000000
   0x00000004 0x02: eax=0x0c00c143 ebx=0x03c0003f ecx=0x00000fff edx=0x00000002
   0x00000004 0x03: eax=0x00000000 ebx=0x00000000 ecx=0x00000000 edx=0x00000000
   0x00000005 0x00: eax=0x00000040 ebx=0x00000040 ecx=0x00000003 edx=0x00022220
   0x00000006 0x00: eax=0x00000003 ebx=0x00000000 ecx=0x00000000 edx=0x00000000
   0x00000007 0x00: eax=0x00000000 ebx=0x000c258b ecx=0x00000000 edx=0x24000000
   0x00000008 0x00: eax=0x00000000 ebx=0x00000000 ecx=0x00000000 edx=0x00000000
   0x00000009 0x00: eax=0x00000000 ebx=0x00000000 ecx=0x00000000 edx=0x00000000
   0x0000000a 0x00: eax=0x07300402 ebx=0x00000000 ecx=0x00000000 edx=0x00000603
   0x0000000b 0x00: eax=0x00000000 ebx=0x00000001 ecx=0x00000100 edx=0x00000000
   0x0000000b 0x01: eax=0x00000002 ebx=0x00000004 ecx=0x00000201 edx=0x00000000
   0x0000000b 0x02: eax=0x00000000 ebx=0x00000000 ecx=0x00000002 edx=0x00000000
   0x0000000c 0x00: eax=0x00000000 ebx=0x00000000 ecx=0x00000000 edx=0x00000000
   0x0000000d 0x00: eax=0x00000007 ebx=0x00000340 ecx=0x00000340 edx=0x00000000
   0x0000000d 0x01: eax=0x00000001 ebx=0x00000000 ecx=0x00000000 edx=0x00000000
   0x0000000d 0x02: eax=0x00000100 ebx=0x00000240 ecx=0x00000000 edx=0x00000000
   0x20000000 0x00: eax=0x00000000 ebx=0x00000000 ecx=0x00000000 edx=0x00000000
   0x80000000 0x00: eax=0x80000008 ebx=0x00000000 ecx=0x00000000 edx=0x00000000
   0x80000001 0x00: eax=0x00000000 ebx=0x00000000 ecx=0x00000121 edx=0x2c100800
   0x80000002 0x00: eax=0x20202020 ebx=0x20202020 ecx=0x20202020 edx=0x20202020
   0x80000003 0x00: eax=0x41485a20 ebx=0x4e49584f ecx=0x69614b20 edx=0x6e616958
   0x80000004 0x00: eax=0x2d584b20 ebx=0x30343635 ecx=0x302e3240 edx=0x007a4847
   0x80000005 0x00: eax=0x04200420 ebx=0x06600660 ecx=0x20080140 edx=0x20080140
   0x80000006 0x00: eax=0x00000000 ebx=0x00000000 ecx=0x10008140 edx=0x00000000
   0x80000007 0x00: eax=0x00000000 ebx=0x00000000 ecx=0x00000000 edx=0x00000100
   0x80000008 0x00: eax=0x00003028 ebx=0x00000000 ecx=0x00000000 edx=0x00000000
   0x80860000 0x00: eax=0x00000000 ebx=0x00000000 ecx=0x00000000 edx=0x00000000
   0xc0000000 0x00: eax=0xc0000004 ebx=0x00000000 ecx=0x00000000 edx=0x00000000
   0xc0000001 0x00: eax=0x000107b0 ebx=0x00000000 ecx=0x00000000 edx=0x1ec33dfc
   0xc0000002 0x00: eax=0x00000000 ebx=0x00000000 ecx=0x00000000 edx=0x00000000
   0xc0000003 0x00: eax=0x00000000 ebx=0x00000000 ecx=0x00000000 edx=0x00000000
   0xc0000004 0x00: eax=0x00000020 ebx=0x18002867 ecx=0x184e2866 edx=0x00000000
CPU 1:
   0x00000000 0x00: eax=0x0000000d ebx=0x746e6543 ecx=0x736c7561 edx=0x48727561
   0x00000001 0x00: eax=0x000107b0 ebx=0x01040800 ecx=0x7fda63eb edx=0xbfcbfbff
   0x00000002 0x00: eax=0x635af001 ebx=0x00000000 ecx=0x00000000 edx=0x000000ff
   0x00000003 0x00: eax=0x00000000 ebx=0x00000000 ecx=0x00000000 edx=0x00000000
   0x00000004 0x00: eax=0x0c000121 ebx=0x01c0003f ecx=0x0000003f edx=0x00000000
   0x00000004 0x01: eax=0x0c000122 ebx=0x01c0003f ecx=0x0000003f edx=0x00000000
   0x00000004 0x02: eax=0x0c00c143 ebx=0x03c0003f ecx=0x00000fff edx=0x00000002
   0x00000004 0x03: eax=0x00000000 ebx=0x00000000 ecx=0x00000000 edx=0x00000000
   0x00000005 0x00: eax=0x00000040 ebx=0x00000040 ecx=0x00000003 edx=0x00022220
   0x00000006 0x00: eax=0x00000003 ebx=0x00000000 ecx=0x00000000 edx=0x00000000
   0x00000007 0x00: eax=0x00000000 ebx=0x000c258b ecx=0x00000000 edx=0x24000000
   0x00000008 0x00: eax=0x00000000 ebx=0x00000000 ecx=0x00000000 edx=0x00000000
   0x00000009 0x00: eax=0x00000000 ebx=0x00000000 ecx=0x00000000 edx=0x00000000
   0x0000000a 0x00: eax=0x07300402 ebx=0x00000000 ecx=0x00000000 edx=0x00000603
   0x0000000b 0x00: eax=0x00000000 ebx=0x00000001 ecx=0x00000100 edx=0x00000001
   0x0000000b 0x01: eax=0x00000002 ebx=0x00000004 ecx=0x00000201 edx=0x00000001
   0x0000000b 0x02: eax=0x00000000 ebx=0x00000000 ecx=0x00000002 edx=0x00000001
   0x0000000c 0x00: eax=0x00000000 ebx=0x00000000 ecx=0x00000000 edx=0x00000000
   0x0000000d 0x00: eax=0x00000007 ebx=0x00000340 ecx=0x00000340 edx=0x00000000
   0x0000000d 0x01: eax=0x00000001 ebx=0x00000000 ecx=0x00000000 edx=0x00000000
   0x0000000d 0x02: eax=0x00000100 ebx=0x00000240 ecx=0x00000000 edx=0x00000000
   0x20000000 0x00: eax=0x00000000 ebx=0x00000000 ecx=0x00000000 edx=0x00000000
   0x80000000 0x00: eax=0x80000008 ebx=0x00000000 ecx=0x00000000 edx=0x00000000
   0x80000001 0x00: eax=0x00000000 ebx=0x00000000 ecx=0x00000121 edx=0x2c100800
   0x80000002 0x00: eax=0x20202020 ebx=0x20202020 ecx=0x20202020 edx=0x20202020
   0x80000003 0x00: eax=0x41485a20 ebx=0x4e49584f ecx=0x69614b20 edx=0x6e616958
   0x80000004 0x00: eax=0x2d584b20 ebx=0x30343635 ecx=0x302e3240 edx=0x007a4847
   0x80000005 0x00: eax=0x04200420 ebx=0x06600660 ecx=0x20080140 edx=0x20080140
   0x80000006 0x00: eax=0x00000000 ebx=0x00000000 ecx=0x10008140 edx=0x00000000
   0x80000007 0x00: eax=0x00000000 ebx=0x00000000 ecx=0x00000000 edx=0x00000100
   0x80000008 0x00: eax=0x00003028 ebx=0x00000000 ecx=0x00000000 edx=0x00000000
   0x80860000 0x00: eax=0x00000000 ebx=0x00000000 ecx=0x00000000 edx=0x00000000
   0xc0000000 0x00: eax=0xc0000004 ebx=0x00000000 ecx=0x00000000 edx=0x00000000
   0xc0000001 0x00: eax=0x000107b0 ebx=0x00000000 ecx=0x00000000 edx=0x1ec33dfc
   0xc0000002 0x00: eax=0x00000000 ebx=0x00000000 ecx=0x00000000 edx=0x00000000
   0xc0000003 0x00: eax=0x00000000 ebx=0x00000000 ecx=0x00000000 edx=0x00000000
   0xc0000004 0x00: eax=0x00000020 ebx=0x18002867 ecx=0x184e2866 edx=0x00000000
CPU 2:
   0x00000000 0x00: eax=0x0000000d ebx=0x746e6543 ecx=0x736c7561 edx=0x48727561
   0x00000001 0x00: eax=0x000107b0 ebx=0x02040800 ecx=0x7fda63eb edx=0xbfcbfbff
   0x00000002 0x00: eax=0x635af001 ebx=0x00000000 ecx=0x00000000 edx=0x000000ff
   0x00000003 0x00: eax=0x00000000 ebx=0x00000000 ecx=0x00000000 edx=0x00000000
   0x00000004 0x00: eax=0x0c000121 ebx=0x01c0003f ecx=0x0000003f edx=0x00000000
   0x00000004 0x01: eax=0x0c000122 ebx=0x01c0003f ecx=0x0000003f edx=0x00000000
   0x00000004 0x02: eax=0x0c00c143 ebx=0x03c0003f ecx=0x00000fff edx=0x00000002
   0x00000004 0x03: eax=0x00000000 ebx=0x00000000 ecx=0x00000000 edx=0x00000000
   0x00000005 0x00: eax=0x00000040 ebx=0x00000040 ecx=0x00000003 edx=0x00022220
   0x00000006 0x00: eax=0x00000003 ebx=0x00000000 ecx=0x00000000 edx=0x00000000
   0x00000007 0x00: eax=0x00000000 ebx=0x000c258b ecx=0x00000000 edx=0x24000000
   0x00000008 0x00: eax=0x00000000 ebx=0x00000000 ecx=0x00000000 edx=0x00000000
   0x00000009 0x00: eax=0x00000000 ebx=0x00000000 ecx=0x00000000 edx=0x00000000
   0x0000000a 0x00: eax=0x07300402 ebx=0x00000000 ecx=0x00000000 edx=0x00000603
   0x0000000b 0x00: eax=0x00000000 ebx=0x00000001 ecx=0x00000100 edx=0x00000002
   0x0000000b 0x01: eax=0x00000002 ebx=0x00000004 ecx=0x00000201 edx=0x00000002
   0x0000000b 0x02: eax=0x00000000 ebx=0x00000000 ecx=0x00000002 edx=0x00000002
   0x0000000c 0x00: eax=0x00000000 ebx=0x00000000 ecx=0x00000000 edx=0x00000000
   0x0000000d 0x00: eax=0x00000007 ebx=0x00000340 ecx=0x00000340 edx=0x00000000
   0x0000000d 0x01: eax=0x00000001 ebx=0x00000000 ecx=0x00000000 edx=0x00000000
   0x0000000d 0x02: eax=0x00000100 ebx=0x00000240 ecx=0x00000000 edx=0x00000000
   0x20000000 0x00: eax=0x00000000 ebx=0x00000000 ecx=0x00000000 edx=0x00000000
   0x80000000 0x00: eax=0x80000008 ebx=0x00000000 ecx=0x00000000 edx=0x00000000
   0x80000001 0x00: eax=0x00000000 ebx=0x00000000 ecx=0x00000121 edx=0x2c100800
   0x80000002 0x00: eax=0x20202020 ebx=0x20202020 ecx=0x20202020 edx=0x20202020
   0x80000003 0x00: eax=0x41485a20 ebx=0x4e49584f ecx=0x69614b20 edx=0x6e616958
   0x80000004 0x00: eax=0x2d584b20 ebx=0x30343635 ecx=0x302e3240 edx=0x007a4847
   0x80000005 0x00: eax=0x04200420 ebx=0x06600660 ecx=0x20080140 edx=0x20080140
   0x80000006 0x00: eax=0x00000000 ebx=0x00000000 ecx=0x10008140 edx=0x00000000
   0x80000007 0x00: eax=0x00000000 ebx=0x00000000 ecx=0x00000000 edx=0x00000100
   0x80000008 0x00: eax=0x00003028 ebx=0x00000000 ecx=0x00000000 edx=0x00000000
   0x80860000 0x00: eax=0x00000000 ebx=0x00000000 ecx=0x00000000 edx=0x00000000
   0xc0000000 0x00: eax=0xc0000004 ebx=0x00000000 ecx=0x00000000 edx=0x00000000
   0xc0000001 0x00: eax=0x000107b0 ebx=0x00000000 ecx=0x00000000 edx=0x1ec33dfc
   0xc0000002 0x00: eax=0x00000000 ebx=0x00000000 ecx=0x00000000 edx=0x00000000
   0xc0000003 0x00: eax=0x00000000 ebx=0x00000000 ecx=0x00000000 edx=0x00000000
   0xc0000004 0x00: eax=0x00000020 ebx=0x18002867 ecx=0x184e2866 edx=0x00000000
CPU 3:
   0x00000000 0x00: eax=0x0000000d ebx=0x746e6543 ecx=0x736c7561 edx=0x48727561
   0x00000001 0x00: eax=0x000107b0 ebx=0x03040800 ecx=0x7fda63eb edx=0xbfcbfbff
   0x00000002 0x00: eax=0x635af001 ebx=0x00000000 ecx=0x00000000 edx=0x000000ff
   0x00000003 0x00: eax=0x00000000 ebx=0x00000000 ecx=0x00000000 edx=0x00000000
   0x00000004 0x00: eax=0x0c000121 ebx=0x01c0003f ecx=0x0000003f edx=0x00000000
   0x00000004 0x01: eax=0x0c000122 ebx=0x01c0003f ecx=0x0000003f edx=0x00000000
   0x00000004 0x02: eax=0x0c00c143 ebx=0x03c0003f ecx=0x00000fff edx=0x00000002
   0x00000004 0x03: eax=0x00000000 ebx=0x00000000 ecx=0x00000000 edx=0x00000000
   0x00000005 0x00: eax=0x00000040 ebx=0x00000040 ecx=0x00000003 edx=0x00022220
   0x00000006 0x00: eax=0x00000003 ebx=0x00000000 ecx=0x00000000 edx=0x00000000
   0x00000007 0x00: eax=0x00000000 ebx=0x000c258b ecx=0x00000000 edx=0x24000000
   0x00000008 0x00: eax=0x00000000 ebx=0x00000000 ecx=0x00000000 edx=0x00000000
   0x00000009 0x00: eax=0x00000000 ebx=0x00000000 ecx=0x00000000 edx=0x00000000
   0x0000000a 0x00: eax=0x07300402 ebx=0x00000000 ecx=0x00000000 edx=0x00000603
   0x0000000b 0x00: eax=0x00000000 ebx=0x00000001 ecx=0x00000100 edx=0x00000003
   0x0000000b 0x01: eax=0x00000002 ebx=0x00000004 ecx=0x00000201 edx=0x00000003
   0x0000000b 0x02: eax=0x00000000 ebx=0x00000000 ecx=0x00000002 edx=0x00000003
   0x0000000c 0x00: eax=0x00000000 ebx=0x00000000 ecx=0x00000000 edx=0x00000000
   0x0000000d 0x00: eax=0x00000007 ebx=0x00000340 ecx=0x00000340 edx=0x00000000
   0x0000000d 0x01: eax=0x00000001 ebx=0x00000000 ecx=0x00000000 edx=0x00000000
   0x0000000d 0x02: eax=0x00000100 ebx=0x00000240 ecx=0x00000000 edx=0x00000000
   0x20000000 0x00: eax=0x00000000 ebx=0x00000000 ecx=0x00000000 edx=0x00000000
   0x80000000 0x00: eax=0x80000008 ebx=0x00000000 ecx=0x00000000 edx=0x00000000
   0x80000001 0x00: eax=0x00000000 ebx=0x00000000 ecx=0x00000121 edx=0x2c100800
   0x80000002 0x00: eax=0x20202020 ebx=0x20202020 ecx=0x20202020 edx=0x20202020
   0x80000003 0x00: eax=0x41485a20 ebx=0x4e49584f ecx=0x69614b20 edx=0x6e616958
   0x80000004 0x00: eax=0x2d584b20 ebx=0x30343635 ecx=0x302e3240 edx=0x007a4847
   0x80000005 0x00: eax=0x04200420 ebx=0x06600660 ecx=0x20080140 edx=0x20080140
   0x80000006 0x00: eax=0x00000000 ebx=0x00000000 ecx=0x10008140 edx=0x00000000
   0x80000007 0x00: eax=0x00000000 ebx=0x00000000 ecx=0x00000000 edx=0x00000100
   0x80000008 0x00: eax=0x00003028 ebx=0x00000000 ecx=0x00000000 edx=0x00000000
   0x80860000 0x00: eax=0x00000000 ebx=0x00000000 ecx=0x00000000 edx=0x00000000
   0xc0000000 0x00: eax=0xc0000004 ebx=0x00000000 ecx=0x00000000 edx=0x00000000
   0xc0000001 0x00: eax=0x000107b0 ebx=0x00000000 ecx=0x00000000 edx=0x1ec33dfc
   0xc0000002 0x00: eax=0x00000000 ebx=0x00000000 ecx=0x00000000 edx=0x00000000
   0xc0000003 0x00: eax=0x00000000 ebx=0x00000000 ecx=0x00000000 edx=0x00000000
   0xc0000004 0x00: eax=0x00000020 ebx=0x18002867 ecx=0x184e2866 edx=0x00000000
