CPU 0:
   0x00000000 0x00: eax=0x00000001 ebx=0x746e6543 ecx=0x736c7561 edx=0x48727561
   0x00000001 0x00: eax=0x000006d0 ebx=0x00000800 ecx=0x00004181 edx=0xa7c9bbff
   0x80000000 0x00: eax=0x80000006 ebx=0x00000000 ecx=0x00000000 edx=0x00000000
   0x80000001 0x00: eax=0x00000000 ebx=0x00000000 ecx=0x00000000 edx=0x00100000
   0x80000002 0x00: eax=0x20202020 ebx=0x20202020 ecx=0x20202020 edx=0x20202020
   0x80000003 0x00: eax=0x20202020 ebx=0x41495620 ecx=0x2d374320 edx=0x7250204d
   0x80000004 0x00: eax=0x7365636f ebx=0x20726f73 ecx=0x30303031 edx=0x007a484d
   0x80000005 0x00: eax=0x00000000 ebx=0x08800880 ecx=0x40040140 edx=0x40040140
   0x80000006 0x00: eax=0x00000000 ebx=0x00000000 ecx=0x0080a140 edx=0x00000000
   0x80860000 0x00: eax=0x00000000 ebx=0x00000000 ecx=0x00000000 edx=0x00000000
   0xc0000000 0x00: eax=0xc0000003 ebx=0x00000000 ecx=0x00000000 edx=0x00000000
   0xc0000001 0x00: eax=0x00000000 ebx=0x00000001 ecx=0x00000000 edx=0x0000ffcc
   0xc0000002 0x00: eax=0x00000000 ebx=0x04000a07 ecx=0x04070a07 edx=0x42840000
   0xc0000003 0x00: eax=0xb1e52dc5 ebx=0xc220bebf ecx=0xb74b9995 edx=0xe2105684
