CPU 0:
   0x00000000 0x00: eax=0x00000001 ebx=0x756e6547 ecx=0x3638784d edx=0x54656e69
   0x00000001 0x00: eax=0x00000543 ebx=0x00000000 ecx=0x00000000 edx=0x0080893f
   0x20000000 0x00: eax=0x00000000 ebx=0x00000000 ecx=0x00000000 edx=0x00000000
   0x80000000 0x00: eax=0x80000006 ebx=0x6e617254 ecx=0x55504361 edx=0x74656d73
   0x80000001 0x00: eax=0x00000543 ebx=0x00000000 ecx=0x00000000 edx=0x0080813f
   0x80000002 0x00: eax=0x6e617254 ebx=0x74656d73 ecx=0x6d742861 edx=0x72432029
   0x80000003 0x00: eax=0x656f7375 ebx=0x296d7428 ecx=0x6f725020 edx=0x73736563
   0x80000004 0x00: eax=0x5420726f ebx=0x3037354d ecx=0x00000030 edx=0x00000000
   0x80000005 0x00: eax=0x00000000 ebx=0x04ff04ff ecx=0x40100120 edx=0x40080140
   0x80000006 0x00: eax=0x00000000 ebx=0x00000000 ecx=0x01004180 edx=0x00000000
   0x80860000 0x00: eax=0x80860007 ebx=0x6e617254 ecx=0x55504361 edx=0x74656d73
   0x80860001 0x00: eax=0x00000543 ebx=0x01050002 ecx=0x00000320 edx=0x000005ce
   0x80860002 0x00: eax=0x00000000 ebx=0x0405020c ecx=0x0000000b edx=0x00000000
   0x80860003 0x00: eax=0x34303032 ebx=0x34313630 ecx=0x3a353120 edx=0x6f203030
   0x80860004 0x00: eax=0x63696666 ebx=0x206c6169 ecx=0x656c6572 edx=0x20657361
   0x80860005 0x00: eax=0x2e352e34 ebx=0x00312332 ecx=0x00000000 edx=0x00000000
   0x80860006 0x00: eax=0x00000000 ebx=0x00000000 ecx=0x00000000 edx=0x00000000
   0x80860007 0x00: eax=0x00000320 ebx=0x000004e2 ecx=0x00000064 edx=0x00005489
   0xc0000000 0x00: eax=0x00000000 ebx=0x00000000 ecx=0x00000000 edx=0x00000000
